post_id,subreddit_id,claim,stage2_labels
ri83g1,t5_2r876,. I remember reading that the treatment group had a decline in lung function of 1% a year while those not taking the drugs had a decline of 2%.,"[{""crowd-entity-annotation"":{""entities"":[{""endOffset"":37,""label"":""intervention"",""startOffset"":22},{""endOffset"":65,""label"":""population"",""startOffset"":50},{""endOffset"":217,""label"":""outcome"",""startOffset"":204}]}}]"
p4y0eq,t5_2r876,Supposedly the R75q is very rare and does not cause CF?,"[{""crowd-entity-annotation"":{""entities"":[{""endOffset"":44,""label"":""population"",""startOffset"":40},{""endOffset"":59,""label"":""population"",""startOffset"":53},{""endOffset"":114,""label"":""population"",""startOffset"":99}]}}]"
rmzlmf,t5_2qlaa,"Google is telling me that the combo is bad - leading to things like heart arrhythmias, c diff infection, etc. ","[{""crowd-entity-annotation"":{""entities"":[{""endOffset"":66,""label"":""intervention"",""startOffset"":55},{""endOffset"":94,""label"":""intervention"",""startOffset"":91},{""endOffset"":197,""label"":""outcome"",""startOffset"":186},{""endOffset"":215,""label"":""outcome"",""startOffset"":199}]}}]"
sejoqp,t5_2r876,"Fyi pbac minutes just got published and trikafta is recommended for over 12s with at least one F508Del
","[{""crowd-entity-annotation"":{""entities"":[{""endOffset"":71,""label"":""intervention"",""startOffset"":63}]}}]"
sqmule,t5_2s3g1,Literally Gas pains were made by devils in the hell !,"[{""crowd-entity-annotation"":{""entities"":[]}}]"
ov5bwu,t5_2syer,My doctor says it's not high enough to warrant taking Allopurinol.,"[{""crowd-entity-annotation"":{""entities"":[{""endOffset"":256,""label"":""outcome"",""startOffset"":239},{""endOffset"":337,""label"":""intervention"",""startOffset"":326}]}}]"
q1wy2z,t5_2r876,"We've heard good things about Banner Univ in Phoenix, but weren't sure about Tucson. (Note - we'll be moving from Dallas.)","[{""crowd-entity-annotation"":{""entities"":[]}}]"
qr4ond,t5_2rtve,"Lupus in Remission Flares More Often When Reducing, Stopping HCQ","[{""crowd-entity-annotation"":{""entities"":[{""endOffset"":5,""label"":""population"",""startOffset"":0}]}}]"
swd5kb,t5_2saq9,I looked up what that means and apprently that can mean medically unexplained symptoms like how could they say its possibly medically unexplained when it is!,"[{""crowd-entity-annotation"":{""entities"":[{""endOffset"":323,""label"":""population"",""startOffset"":302},{""endOffset"":329,""label"":""population"",""startOffset"":325},{""endOffset"":369,""label"":""intervention"",""startOffset"":357},{""endOffset"":1551,""label"":""outcome"",""startOffset"":1541}]}}]"
rxyvx3,t5_2tyg2,"This ballerina spins different directions based upon your mental activity. If we as a group witness this image and individually we each see her spin a different way and at different times. This effect implies life is a recreation of sensory inputs to the brain such as visual and that we all solely generate the world around us by ourselves. We all see the same image. Yet it differs from one to the next. This implies our sensory inputs and electrical signals we receive, the brain recreates reality and life isn't some kind of live stream that's same for the all of us.","[{""crowd-entity-annotation"":{""entities"":[]}}]"
p6rg6k,t5_2syer," Had I known it was gout, I could have avoided the food at the mess hall all week: red meat non stop among other just bad food choices.","[{""crowd-entity-annotation"":{""entities"":[{""endOffset"":210,""label"":""population"",""startOffset"":200},{""endOffset"":416,""label"":""population"",""startOffset"":412},{""endOffset"":555,""label"":""intervention"",""startOffset"":547},{""endOffset"":1021,""label"":""intervention"",""startOffset"":1011},{""endOffset"":1036,""label"":""intervention"",""startOffset"":1026},{""endOffset"":1218,""label"":""outcome"",""startOffset"":1210},{""endOffset"":1282,""label"":""outcome"",""startOffset"":1276},{""endOffset"":1419,""label"":""outcome"",""startOffset"":1415}]}}]"
rk389q,t5_2s1h9,A proper sleep schedule would probably help me avoid some of those problems but working irregular shifts makes that quite impossible,"[{""crowd-entity-annotation"":{""entities"":[{""endOffset"":1172,""label"":""intervention"",""startOffset"":1151}]}}]"
q18aul,t5_2syer,My doctor has seen a consistently high level of Uric Acid in previous blood tests,"[{""crowd-entity-annotation"":{""entities"":[]}}]"
rqq0l4,t5_2rtve,I'm aware of all the stigma around the whole practic,"[{""crowd-entity-annotation"":{""entities"":[{""endOffset"":13,""label"":""intervention"",""startOffset"":0}]}}]"
snh2wa,t5_2syer,Bai coconut works excellent as the liquid base and it actually tastes good,"[{""crowd-entity-annotation"":{""entities"":[{""endOffset"":71,""label"":""intervention"",""startOffset"":56},{""endOffset"":93,""label"":""intervention"",""startOffset"":82},{""endOffset"":127,""label"":""intervention"",""startOffset"":119},{""endOffset"":157,""label"":""outcome"",""startOffset"":139},{""endOffset"":171,""label"":""intervention"",""startOffset"":159}]}}]"
skwm9c,t5_2s3g1,Typically it results in diarrhea or loose stools but there can be some constipation too,"[{""crowd-entity-annotation"":{""entities"":[{""endOffset"":340,""label"":""intervention"",""startOffset"":321},{""endOffset"":448,""label"":""outcome"",""startOffset"":439},{""endOffset"":463,""label"":""outcome"",""startOffset"":451},{""endOffset"":499,""label"":""outcome"",""startOffset"":486}]}}]"
sqrihx,t5_2s3g1,Intestinal Fungal Dysbiosis Is Associated With Visceral Hypersensitivity in Patients With Irritable Bowel Syndrome and Rats (2017),"[{""crowd-entity-annotation"":{""entities"":[{""endOffset"":27,""label"":""population"",""startOffset"":0},{""endOffset"":72,""label"":""population"",""startOffset"":47},{""endOffset"":114,""label"":""population"",""startOffset"":90}]}}]"
rjubai,t5_2syer,I went to refill my allopurinol that it could potentially cause hair loss and darkening skin,"[{""crowd-entity-annotation"":{""entities"":[{""endOffset"":92,""label"":""intervention"",""startOffset"":81},{""endOffset"":164,""label"":""outcome"",""startOffset"":137},{""endOffset"":204,""label"":""outcome"",""startOffset"":191},{""endOffset"":228,""label"":""outcome"",""startOffset"":214}]}}]"
rpwzxz,t5_2qlaa,I know a lot of people have great things to say about it and its gold standard,"[{""crowd-entity-annotation"":{""entities"":[{""endOffset"":81,""label"":""intervention"",""startOffset"":74}]}}]"
sf1u81,t5_2saq9,Sick of folks not taking this condition seriously.,"[{""crowd-entity-annotation"":{""entities"":[{""endOffset"":152,""label"":""population"",""startOffset"":148},{""endOffset"":160,""label"":""population"",""startOffset"":157}]}}]"
skmfd2,t5_2tyg2,I thought of asking my psychiatrist to prescribe me appetite suppressants.,"[{""crowd-entity-annotation"":{""entities"":[{""endOffset"":21,""label"":""intervention"",""startOffset"":9},{""endOffset"":147,""label"":""intervention"",""startOffset"":133}]}}]"
r0mj4f,t5_2r876,"Apple's Memoji introduced oxygen goggles
&","[{""crowd-entity-annotation"":{""entities"":[]}}]"
rfr5ul,t5_2qlaa,Buspar (heard some good stories and then some bad ones about brain zaps with every dose???),"[{""crowd-entity-annotation"":{""entities"":[{""endOffset"":1642,""label"":""intervention"",""startOffset"":1635},{""endOffset"":1706,""label"":""outcome"",""startOffset"":1696}]}}]"
rqy4tl,t5_2qlaa,All the news about it possibly causing stomach cancer and dementia are bothering me,"[{""crowd-entity-annotation"":{""entities"":[{""endOffset"":69,""label"":""intervention"",""startOffset"":63},{""endOffset"":148,""label"":""population"",""startOffset"":142},{""endOffset"":161,""label"":""population"",""startOffset"":153}]}}]"
s3vbqa,t5_2saq9,"I was told strength training is really not safe for people with pots, so I'm wondering if that plays into your workout routines at all.","[{""crowd-entity-annotation"":{""entities"":[{""endOffset"":42,""label"":""population"",""startOffset"":38},{""endOffset"":55,""label"":""population"",""startOffset"":43},{""endOffset"":73,""label"":""population"",""startOffset"":56}]}}]"
spgn47,t5_2s23e,And apparently having depression and MS is not a good combi. I am scared and worried and idk what to do.,"[{""crowd-entity-annotation"":{""entities"":[]}}]"
s75yrr,t5_2s23e,"I have, and the general guidance is to get the vaccine and either one is fine. However none of the professionals Ive talked to specialize in MS and so Im just looking for additional information/guidance/peace of mind from this community. ","[{""crowd-entity-annotation"":{""entities"":[{""endOffset"":1438,""label"":""intervention"",""startOffset"":1430},{""endOffset"":1527,""label"":""population"",""startOffset"":1524}]}}]"
ppqqd7,t5_2syer,I read a few studies about gut bacteria and how apparently the intestine is supposed to eliminate about 30% UA and most gout sufferers can be identified from a bacteria sample.,"[{""crowd-entity-annotation"":{""entities"":[{""endOffset"":10,""label"":""intervention"",""startOffset"":0},{""endOffset"":19,""label"":""population"",""startOffset"":15}]}}]"
qfo9n2,t5_2rtve,Experimental Immunotherapy Puts Lupus into Remission for Young Patient,"[{""crowd-entity-annotation"":{""entities"":[{""endOffset"":26,""label"":""intervention"",""startOffset"":0},{""endOffset"":38,""label"":""population"",""startOffset"":32},{""endOffset"":52,""label"":""outcome"",""startOffset"":43}]}}]"
ro6xfe,t5_2s1h9,"For example if I take 2 or 3 tokes, I can still function without a noticeable change in my state of mind, but if I take 4 to 5 tokes, that's when the psychoactive effects of cannibis feel the strongest and starts affecting executive function and motor function.","[{""crowd-entity-annotation"":{""entities"":[{""endOffset"":477,""label"":""outcome"",""startOffset"":457},{""endOffset"":490,""label"":""intervention"",""startOffset"":481}]}}]"
qxuwbv,t5_2syer,I heard its supposed to purify the blood and prevent liver damage and supposedly good for inflammation.,"[{""crowd-entity-annotation"":{""entities"":[{""endOffset"":12,""label"":""intervention"",""startOffset"":0},{""endOffset"":81,""label"":""outcome"",""startOffset"":65},{""endOffset"":106,""label"":""outcome"",""startOffset"":94},{""endOffset"":143,""label"":""outcome"",""startOffset"":131}]}}]"
sjpcn0,t5_2s23e,one that I've heard is really effective.,"[{""crowd-entity-annotation"":{""entities"":[{""endOffset"":496,""label"":""intervention"",""startOffset"":489}]}}]"
siz4n2,t5_2s23e,"Video from Dr. Beaber about the study on US Military personnel causally linking EBV with MS
Title says it all: [https://www.youtube.com/watch?v=3bkEXWg3kTw](https://www.youtube.com/watch?v=3bkEXWg3kTw)
","[{""crowd-entity-annotation"":{""entities"":[{""endOffset"":84,""label"":""intervention"",""startOffset"":80},{""endOffset"":91,""label"":""outcome"",""startOffset"":89}]}}]"
s0a0ky,t5_2qlaa,Theres a surgeon in Houston that claims GERD inevitably progresses from occasional heartburn to Barretts and even cancer,"[{""crowd-entity-annotation"":{""entities"":[{""endOffset"":7,""label"":""population"",""startOffset"":3},{""endOffset"":323,""label"":""outcome"",""startOffset"":314},{""endOffset"":335,""label"":""outcome"",""startOffset"":327},{""endOffset"":351,""label"":""outcome"",""startOffset"":345},{""endOffset"":550,""label"":""intervention"",""startOffset"":547}]}}]"
q64egd,t5_2syer,"I thought the gout had moved to my elbow, but my uncle (an MD, but not my Dr) thinks its Busitus","[{""crowd-entity-annotation"":{""entities"":[{""endOffset"":600,""label"":""outcome"",""startOffset"":591},{""endOffset"":815,""label"":""population"",""startOffset"":808}]}}]"
rqd5qz,t5_2qlaa,I am already aware that taking this medication for over 12 weeks is dangerous as it can cause tardive dyskensia,"[{""crowd-entity-annotation"":{""entities"":[{""endOffset"":505,""label"":""intervention"",""startOffset"":491},{""endOffset"":619,""label"":""outcome"",""startOffset"":602}]}}]"
rqg6us,t5_2r876,Ive been googling if we can and the answers are very split.,"[{""crowd-entity-annotation"":{""entities"":[{""endOffset"":126,""label"":""intervention"",""startOffset"":118},{""endOffset"":156,""label"":""population"",""startOffset"":144}]}}]"
rwldz4,t5_2s1h9,My boyfriend was diagnosed at ~15 years old and is now 23,"[{""crowd-entity-annotation"":{""entities"":[]}}]"
p46c5f,t5_2syer,After researching I'm finding febuxostat should only be used if allopurinol does not work.,"[{""crowd-entity-annotation"":{""entities"":[{""endOffset"":164,""label"":""population"",""startOffset"":160},{""endOffset"":464,""label"":""intervention"",""startOffset"":454},{""endOffset"":499,""label"":""intervention"",""startOffset"":488}]}}]"
rd7zd3,t5_2qlaa,Everybody said that their shoulder pain stopped in 3-4 days or a week,"[{""crowd-entity-annotation"":{""entities"":[{""endOffset"":49,""label"":""intervention"",""startOffset"":20},{""endOffset"":151,""label"":""outcome"",""startOffset"":147},{""endOffset"":327,""label"":""outcome"",""startOffset"":323}]}}]"
rxyvx3,t5_2tyg2,"The world is a recreation of your brain, spinning ballerina proves it","[{""crowd-entity-annotation"":{""entities"":[]}}]"
qexo8s,t5_2syer,my Rheumatologist thinks that my kidneys and liver have a hard time clearing uric acid out of my blood rather than I ingest too many purines.,"[{""crowd-entity-annotation"":{""entities"":[]}}]"
si9qv7,t5_2s23e,that a high WBC is an indicator of such,"[{""crowd-entity-annotation"":{""entities"":[{""endOffset"":56,""label"":""intervention"",""startOffset"":49},{""endOffset"":100,""label"":""intervention"",""startOffset"":92},{""endOffset"":214,""label"":""population"",""startOffset"":211},{""endOffset"":232,""label"":""population"",""startOffset"":221},{""endOffset"":262,""label"":""population"",""startOffset"":251},{""endOffset"":487,""label"":""outcome"",""startOffset"":483},{""endOffset"":502,""label"":""outcome"",""startOffset"":492},{""endOffset"":550,""label"":""outcome"",""startOffset"":544},{""endOffset"":556,""label"":""outcome"",""startOffset"":551},{""endOffset"":808,""label"":""intervention"",""startOffset"":797},{""endOffset"":876,""label"":""population"",""startOffset"":870}]}}]"
p1q6po,t5_2syer,Have heard that flares can happen once allopurinol starts working,"[{""crowd-entity-annotation"":{""entities"":[{""endOffset"":535,""label"":""outcome"",""startOffset"":528},{""endOffset"":563,""label"":""intervention"",""startOffset"":551}]}}]"
s5hcx7,t5_2s23e,In light of the recent news linking Epstein Barr Virus (EBV) to later cases of MS,"[{""crowd-entity-annotation"":{""entities"":[]}}]"
qbfqzr,t5_2syer,". In his book he talks about one of the main benefits as massively reducing the amount of inflammation in the body, which is the source of all sorts of chronic disease","[{""crowd-entity-annotation"":{""entities"":[]}}]"
sn4zg2,t5_2rtve,Just read that lupus is associated with a 5 fold increase in likelihood of developing a hepatic hemangioma.,"[{""crowd-entity-annotation"":{""entities"":[{""endOffset"":126,""label"":""population"",""startOffset"":108},{""endOffset"":482,""label"":""population"",""startOffset"":467}]}}]"
snnixa,t5_2syer,"Doesnt think its diet related as Im young, appropriate weight, and all other blood work came back good except for the uric acid","[{""crowd-entity-annotation"":{""entities"":[{""endOffset"":24,""label"":""intervention"",""startOffset"":19},{""endOffset"":543,""label"":""outcome"",""startOffset"":524},{""endOffset"":599,""label"":""population"",""startOffset"":593}]}}]"
sr6v4o,t5_2s23e,I guess i will need more steroids for some time and a lot of PT/acute rehab.,"[{""crowd-entity-annotation"":{""entities"":[{""endOffset"":12,""label"":""population"",""startOffset"":10},{""endOffset"":402,""label"":""intervention"",""startOffset"":393},{""endOffset"":443,""label"":""intervention"",""startOffset"":429}]}}]"
s0a0ky,t5_2qlaa,many people are able to treat their GERD effectively with PPIs and/or lifestyle changes.,"[{""crowd-entity-annotation"":{""entities"":[{""endOffset"":276,""label"":""population"",""startOffset"":271},{""endOffset"":541,""label"":""outcome"",""startOffset"":513},{""endOffset"":552,""label"":""intervention"",""startOffset"":547},{""endOffset"":576,""label"":""intervention"",""startOffset"":559}]}}]"
s8nbvn,t5_2s23e,"Had my first MRI since diagnosis (2018 due to insurance issues) and the interpretation reads T2 hyperintensity in the posterior cervical cord at C4-5 and T2 FLAIR white matter hyperintensities in the periventricular and subcortical distribution.
","[{""crowd-entity-annotation"":{""entities"":[{""endOffset"":38,""label"":""population"",""startOffset"":23}]}}]"
sp9kil,t5_2s23e,"Patients Who Stop Tysabri for Pregnancy at Higher Risk for Relapse
see here","[{""crowd-entity-annotation"":{""entities"":[{""endOffset"":25,""label"":""intervention"",""startOffset"":13},{""endOffset"":66,""label"":""outcome"",""startOffset"":59}]}}]"
s1hwai,t5_2s23e,"High Levels of Gut Bacterial Toxins (p-cresol-sulfate, indoxyl-sulfate, & N-phenylacetylglutamine) that are known to be toxic to nerve cells found in Spinal Fluid of MS Patients. Once these toxic compounds get into the CSF, they may contribute to nerve cell death & damage to the myelin sheath","[{""crowd-entity-annotation"":{""entities"":[{""endOffset"":36,""label"":""intervention"",""startOffset"":0},{""endOffset"":263,""label"":""outcome"",""startOffset"":233},{""endOffset"":293,""label"":""outcome"",""startOffset"":266}]}}]"
s8aasz,t5_2saq9,I hear midodrine is good for low bp but its more expensive and the side effects sound kind of iffy to me.,"[{""crowd-entity-annotation"":{""entities"":[{""endOffset"":23,""label"":""population"",""startOffset"":21},{""endOffset"":39,""label"":""intervention"",""startOffset"":29},{""endOffset"":499,""label"":""intervention"",""startOffset"":490}]}}]"
pps8o4,t5_2syer,"One of the side effects of Fenofibrate is decreased kidney functions - specifically the increase of serum creatinine levels. [here](http://www.medscape.com/viewarticle/815413)


When googling, theres medical tests that seemingly confirm high serum creatinine levels can raise uric acid: [here](https://www.ncbi.nlm.nih.gov/pmc/articles/PMC1004629/)","[{""crowd-entity-annotation"":{""entities"":[{""endOffset"":1884,""label"":""intervention"",""startOffset"":1872},{""endOffset"":1913,""label"":""outcome"",""startOffset"":1897},{""endOffset"":1968,""label"":""outcome"",""startOffset"":1945}]}}]"
q5nfxj,t5_2syer,"I see a lot of talk about testing every couple of months when started allopurinol, or every 6-12 months once the ideal dose has been found. But this assumes that allopurinol stabilizes UA fluctuations as well as lowers it. Is that known to be true? I haven't read that anywhere yet. 
","[{""crowd-entity-annotation"":{""entities"":[{""endOffset"":92,""label"":""intervention"",""startOffset"":81}]}}]"
svzcah,t5_2tyg2," I was on here the other day asking about if maybe my symptoms were a lot like schizophrenia, and I was doing more research on it and I saw DID","[{""crowd-entity-annotation"":{""entities"":[{""endOffset"":113,""label"":""population"",""startOffset"":100}]}}]"
rc3g84,t5_2rtve,FDA issues an EUA for long-acting antibodies (Evusheld) for Covid-19 prevention in moderately to severely immunocompromised people,"[{""crowd-entity-annotation"":{""entities"":[{""endOffset"":54,""label"":""intervention"",""startOffset"":46},{""endOffset"":68,""label"":""population"",""startOffset"":60}]}}]"
prd6j4,t5_2syer,While recognizing that ones diet must improve and healthy eating is important for gout and related issues,"[{""crowd-entity-annotation"":{""entities"":[{""endOffset"":76,""label"":""intervention"",""startOffset"":62},{""endOffset"":99,""label"":""population"",""startOffset"":94},{""endOffset"":153,""label"":""intervention"",""startOffset"":148},{""endOffset"":276,""label"":""outcome"",""startOffset"":265}]}}]"
pvfk2b,t5_2r876,CFF seems to not recommend this practice,"[{""crowd-entity-annotation"":{""entities"":[{""endOffset"":128,""label"":""intervention"",""startOffset"":95},{""endOffset"":160,""label"":""population"",""startOffset"":131}]}}]"
r6ia9m,t5_2syer,I thought it was a physical injury for ages,"[{""crowd-entity-annotation"":{""entities"":[{""endOffset"":17,""label"":""outcome"",""startOffset"":0},{""endOffset"":787,""label"":""population"",""startOffset"":783}]}}]"
swveu1,t5_2s3g1,ibs is chronic while gastritis dosen't last long.,"[{""crowd-entity-annotation"":{""entities"":[{""endOffset"":92,""label"":""population"",""startOffset"":83},{""endOffset"":214,""label"":""outcome"",""startOffset"":207},{""endOffset"":338,""label"":""population"",""startOffset"":335},{""endOffset"":455,""label"":""outcome"",""startOffset"":449}]}}]"
rqjp0d,t5_2syer,I saw a couple of studies online that suggest there could be a link,"[{""crowd-entity-annotation"":{""entities"":[{""endOffset"":5,""label"":""population"",""startOffset"":0},{""endOffset"":247,""label"":""outcome"",""startOffset"":240}]}}]"
ro9vqg,t5_2r876,Dealing with one right now and everyone is telling me Im too young to be getting them.,"[{""crowd-entity-annotation"":{""entities"":[{""endOffset"":34,""label"":""population"",""startOffset"":31},{""endOffset"":69,""label"":""outcome"",""startOffset"":56}]}}]"
sk1dqo,t5_2syer,"I recently heard that Mark Cuban's new pharmaceutical venture, CostPlus Drug Company, offers allopurinol and colchicine at reduced costs","[{""crowd-entity-annotation"":{""entities"":[{""endOffset"":52,""label"":""intervention"",""startOffset"":40},{""endOffset"":66,""label"":""intervention"",""startOffset"":56}]}}]"
p357z0,t5_2syer,I read in online that one should not stop ult abruptly,"[{""crowd-entity-annotation"":{""entities"":[{""endOffset"":84,""label"":""intervention"",""startOffset"":80},{""endOffset"":157,""label"":""outcome"",""startOffset"":135}]}}]"
rz39f5,t5_2qlaa,"So I been taking these pills for a little while now and I just read up on these and similar ones that if you take these pills for a long period of time, you can be a high risk of kidney disease","[{""crowd-entity-annotation"":{""entities"":[{""endOffset"":11,""label"":""intervention"",""startOffset"":0},{""endOffset"":211,""label"":""outcome"",""startOffset"":197}]}}]"
p3t0un,t5_2syer,I'm looking into getting celery seed and tart cherry pills as it seems these may have moderate benefits in preventing or shortening the duration of flare ups.,"[{""crowd-entity-annotation"":{""entities"":[{""endOffset"":48,""label"":""intervention"",""startOffset"":37},{""endOffset"":70,""label"":""intervention"",""startOffset"":52},{""endOffset"":169,""label"":""outcome"",""startOffset"":160}]}}]"
s0d2tq,t5_2qlaa,"i read everywhere that says don't drink water 2-3 hrs after meals, even my doctor said don't drink water 3 hrs after meals, so if we count we can see we don't drink water for 10 hours in a day even after a dinner we just have almost 1 hour to drink water and after that we can't because of going to bed.","[{""crowd-entity-annotation"":{""entities"":[{""endOffset"":70,""label"":""outcome"",""startOffset"":59}]}}]"
rhlkih,t5_2rtve,I know that it causes SLE in 90% of cases but I cant find how many of this type of deficiency there is in the world today,"[{""crowd-entity-annotation"":{""entities"":[{""endOffset"":183,""label"":""intervention"",""startOffset"":180}]}}]"
otzijr,t5_2syer,Ive seen a lot of talk about colchicine and allopurinal,"[{""crowd-entity-annotation"":{""entities"":[{""endOffset"":1210,""label"":""intervention"",""startOffset"":1199},{""endOffset"":1225,""label"":""intervention"",""startOffset"":1214}]}}]"
s297ip,t5_2saq9,Packaged soups arent necessarily healthy but if you want an easy way to get plenty of sodium then they work amazingly :),"[{""crowd-entity-annotation"":{""entities"":[{""endOffset"":89,""label"":""intervention"",""startOffset"":83},{""endOffset"":106,""label"":""intervention"",""startOffset"":94},{""endOffset"":249,""label"":""intervention"",""startOffset"":241},{""endOffset"":280,""label"":""outcome"",""startOffset"":268},{""endOffset"":292,""label"":""outcome"",""startOffset"":285}]}}]"
rloqjd,t5_2qlaa,"hiatal hernia. I cant have spicy foods, Stone says. The issue, it turns out, is that part of her stomach protrudes into my esophagus, which sounds gnarly but is actually pretty manageable, increased chances of acid reflux notwithstanding. I was born with it, Stone notes","[{""crowd-entity-annotation"":{""entities"":[{""endOffset"":300,""label"":""population"",""startOffset"":287},{""endOffset"":419,""label"":""outcome"",""startOffset"":410},{""endOffset"":508,""label"":""outcome"",""startOffset"":497}]}}]"
poursf,t5_2syer,"Creatine can cause flareups in those with gout, but it can also cause gout in those without it.","[{""crowd-entity-annotation"":{""entities"":[{""endOffset"":559,""label"":""intervention"",""startOffset"":551},{""endOffset"":579,""label"":""outcome"",""startOffset"":570},{""endOffset"":597,""label"":""population"",""startOffset"":593}]}}]"
sse12s,t5_2s23e,"In this study I am reading it as only 26 percent of patients had disability worsening for twelve years after onset of symptoms and the start of a low efficacy medication.
","[{""crowd-entity-annotation"":{""entities"":[]}}]"
ouweyz,t5_2r876,I believe trikafta has given me PMDD premenstrual dysphagia disorder,"[{""crowd-entity-annotation"":{""entities"":[{""endOffset"":38,""label"":""intervention"",""startOffset"":30},{""endOffset"":56,""label"":""intervention"",""startOffset"":52},{""endOffset"":151,""label"":""outcome"",""startOffset"":144},{""endOffset"":281,""label"":""intervention"",""startOffset"":268}]}}]"
