post_id,subreddit_id,claim,stage2_labels
sn9u41,t5_2s23e,I read an old thread on here that someone said she thinks that her immune system is retaliating because it can no longer cross the blood brain barrier. That doesnt sound scientific lol but it makes sense to me kinda.,"[{""crowd-entity-annotation"":{""entities"":[{""endOffset"":8,""label"":""intervention"",""startOffset"":0},{""endOffset"":167,""label"":""outcome"",""startOffset"":142},{""endOffset"":351,""label"":""outcome"",""startOffset"":342}]}}]"
p7j49y,t5_2syer,"I have read that gout can't be cured, that it's caused by a number of factors outside of diet including kidneys unable to flush uric acid quickly enough, enzymes in body from genetics producing too much uric acid, autoimmune and inflammation issues etc.","[{""crowd-entity-annotation"":{""entities"":[{""endOffset"":1423,""label"":""population"",""startOffset"":1418}]}}]"
smgy0q,t5_2s3g1,I always read stories of people who suffer from IBS and I instantly gain the courage to stop feeling sorry for myself,"[{""crowd-entity-annotation"":{""entities"":[{""endOffset"":107,""label"":""population"",""startOffset"":104},{""endOffset"":136,""label"":""outcome"",""startOffset"":124}]}}]"
sxglhl,t5_2s3g1,Our results indicate that the addition of probiotic supplement containing B. coagulans to the low FODMAP diet might be superior to low FODMAP diet in alleviating IBS symptoms.,"[{""crowd-entity-annotation"":{""entities"":[{""endOffset"":21,""label"":""intervention"",""startOffset"":3},{""endOffset"":53,""label"":""intervention"",""startOffset"":47},{""endOffset"":125,""label"":""population"",""startOffset"":90},{""endOffset"":1528,""label"":""intervention"",""startOffset"":1519}]}}]"
rxyk1d,t5_2s1h9,Ive read that amnesia always followed a tonic clonic,"[{""crowd-entity-annotation"":{""entities"":[{""endOffset"":352,""label"":""outcome"",""startOffset"":344},{""endOffset"":382,""label"":""intervention"",""startOffset"":370}]}}]"
rtkrw2,t5_2qlaa,Seen quite a few posts on here from people who are losing weight when they don't want to but I'm interesting to know if any of my fellow fatties have managed to reduce their symptoms by losing weight?,"[{""crowd-entity-annotation"":{""entities"":[{""endOffset"":113,""label"":""intervention"",""startOffset"":100}]}}]"
sfc8e0,t5_2tyg2,"Here it says, in the DSM book","[{""crowd-entity-annotation"":{""entities"":[]}}]"
sunyzg,t5_2saq9,it was listed as one of the side effects of propranolol.,"[{""crowd-entity-annotation"":{""entities"":[{""endOffset"":88,""label"":""outcome"",""startOffset"":75},{""endOffset"":112,""label"":""intervention"",""startOffset"":101}]}}]"
rce8q9,t5_2rtve,Not sure if its still Seb Derm or a Lupus symptom.,"[{""crowd-entity-annotation"":{""entities"":[]}}]"
rffu7z,t5_2s1h9,Some people with epilepsy can experience worsening mood as their seizures become better controlled because the seizures themselves have positive mood effects like mild electroshock therapy (which are electrically induced seizures),"[{""crowd-entity-annotation"":{""entities"":[{""endOffset"":8,""label"":""population"",""startOffset"":0},{""endOffset"":647,""label"":""population"",""startOffset"":636},{""endOffset"":659,""label"":""population"",""startOffset"":652}]}}]"
su2hs2,t5_2s23e,"I'm interested in getting my first tattoo, but I've heard that they can mess with MRI's","[{""crowd-entity-annotation"":{""entities"":[]}}]"
s8ntsi,t5_2s23e,I have seen an ENT and a neuro who only said my migraines are bad and nothing they be concerned about,"[{""crowd-entity-annotation"":{""entities"":[{""endOffset"":242,""label"":""population"",""startOffset"":233},{""endOffset"":424,""label"":""outcome"",""startOffset"":407},{""endOffset"":697,""label"":""population"",""startOffset"":690},{""endOffset"":718,""label"":""outcome"",""startOffset"":711},{""endOffset"":730,""label"":""outcome"",""startOffset"":723},{""endOffset"":1092,""label"":""population"",""startOffset"":1090},{""endOffset"":1312,""label"":""intervention"",""startOffset"":1302},{""endOffset"":1332,""label"":""intervention"",""startOffset"":1317},{""endOffset"":1472,""label"":""outcome"",""startOffset"":1465},{""endOffset"":1907,""label"":""outcome"",""startOffset"":1890},{""endOffset"":1976,""label"":""outcome"",""startOffset"":1968},{""endOffset"":2003,""label"":""outcome"",""startOffset"":1994},{""endOffset"":2111,""label"":""outcome"",""startOffset"":2105},{""endOffset"":2161,""label"":""population"",""startOffset"":2151}]}}]"
sv66ww,t5_2saq9,"She has been seen by many specialists but only given advice to eat more salt, hydrate and mild exercise.","[{""crowd-entity-annotation"":{""entities"":[{""endOffset"":54,""label"":""outcome"",""startOffset"":33},{""endOffset"":146,""label"":""intervention"",""startOffset"":142},{""endOffset"":155,""label"":""intervention"",""startOffset"":148},{""endOffset"":258,""label"":""population"",""startOffset"":254}]}}]"
s75kjj,t5_2s23e,"I know fellows are certified neurologists and are starting to specialize, they're qualified but maybe just not as experienced as an attending.","[{""crowd-entity-annotation"":{""entities"":[{""endOffset"":58,""label"":""population"",""startOffset"":54}]}}]"
r04i8v,t5_2rtve,"Im not sure if this is anxiety, lupus, or something else. ","[{""crowd-entity-annotation"":{""entities"":[{""endOffset"":25,""label"":""outcome"",""startOffset"":20},{""endOffset"":79,""label"":""population"",""startOffset"":74},{""endOffset"":113,""label"":""outcome"",""startOffset"":109},{""endOffset"":351,""label"":""population"",""startOffset"":344}]}}]"
rpvwti,t5_2syer,I also just read prednisone lowers UA,"[{""crowd-entity-annotation"":{""entities"":[{""endOffset"":87,""label"":""intervention"",""startOffset"":71},{""endOffset"":115,""label"":""outcome"",""startOffset"":92},{""endOffset"":499,""label"":""intervention"",""startOffset"":475},{""endOffset"":711,""label"":""outcome"",""startOffset"":701},{""endOffset"":756,""label"":""population"",""startOffset"":751}]}}]"
s2ryta,t5_2saq9,"I know there's different types of POTS, but I can never find an explanation for them that is in simple terms.","[{""crowd-entity-annotation"":{""entities"":[{""endOffset"":76,""label"":""population"",""startOffset"":72}]}}]"
sl01em,t5_2saq9,". I have recently stumbled across MCAS, and have wondered if thats possibly my problem. ","[{""crowd-entity-annotation"":{""entities"":[{""endOffset"":46,""label"":""population"",""startOffset"":42},{""endOffset"":138,""label"":""outcome"",""startOffset"":129},{""endOffset"":195,""label"":""outcome"",""startOffset"":187},{""endOffset"":213,""label"":""outcome"",""startOffset"":197},{""endOffset"":232,""label"":""outcome"",""startOffset"":230}]}}]"
pufiyn,t5_2syer,One of his reasons was that he doesn't want me to suffer more flare-ups caused by the allo,"[{""crowd-entity-annotation"":{""entities"":[{""endOffset"":814,""label"":""outcome"",""startOffset"":805},{""endOffset"":833,""label"":""intervention"",""startOffset"":829}]}}]"
q40w3u,t5_2syer,after reading about the potential long term effects to joints if not properly treated through medication,"[{""crowd-entity-annotation"":{""entities"":[{""endOffset"":50,""label"":""population"",""startOffset"":45},{""endOffset"":188,""label"":""outcome"",""startOffset"":181}]}}]"
s368jw,t5_2tyg2,"The symptoms according to Wikipedia (which im aware isnt very trustworthy as a source are)
","[{""crowd-entity-annotation"":{""entities"":[]}}]"
rdm8bu,t5_2qlaa,"Recently I ordered some little packets of Coffee Tamer from Amazon, which claim to cut the acid by 90%.","[{""crowd-entity-annotation"":{""entities"":[{""endOffset"":47,""label"":""population"",""startOffset"":43},{""endOffset"":451,""label"":""outcome"",""startOffset"":442},{""endOffset"":479,""label"":""intervention"",""startOffset"":467},{""endOffset"":527,""label"":""intervention"",""startOffset"":516},{""endOffset"":560,""label"":""population"",""startOffset"":552}]}}]"
poa5ta,t5_2r876,just want to know your experiences with a gtube. did it help?,"[{""crowd-entity-annotation"":{""entities"":[{""endOffset"":685,""label"":""intervention"",""startOffset"":680}]}}]"
r3v542,t5_2rtve,The problem is I take Lexapro for anxiety and the two can't be taken together from what I understand.,"[{""crowd-entity-annotation"":{""entities"":[{""endOffset"":17,""label"":""population"",""startOffset"":12},{""endOffset"":29,""label"":""population"",""startOffset"":22},{""endOffset"":122,""label"":""intervention"",""startOffset"":113},{""endOffset"":198,""label"":""intervention"",""startOffset"":191}]}}]"
ru88hn,t5_2syer,"Eating way too much sugar, not drinking enough water, and all the other things I know cause gout issues.","[{""crowd-entity-annotation"":{""entities"":[{""endOffset"":328,""label"":""intervention"",""startOffset"":323},{""endOffset"":355,""label"":""intervention"",""startOffset"":350},{""endOffset"":400,""label"":""population"",""startOffset"":395}]}}]"
pmtznu,t5_2r876,My parents were told I can't have cf and they didn't know why I had the chronic issues I had but that both parents must be carriers..that was in 1995,"[{""crowd-entity-annotation"":{""entities"":[]}}]"
s9akap,t5_2tyg2,I remember asking if anyone was there and I actually got a response inside my head. For a while I believed maybe someone was there. The off hearing someone saying sentences or words lasted for months and still occasionally happens. Though now I have stopped trying to purposely hear them.,"[{""crowd-entity-annotation"":{""entities"":[]}}]"
svlp4p,t5_2s3g1,"She did take a blood test for any food allergies and after negative results, just deemed that I had IBS","[{""crowd-entity-annotation"":{""entities"":[{""endOffset"":77,""label"":""population"",""startOffset"":74},{""endOffset"":250,""label"":""outcome"",""startOffset"":242},{""endOffset"":264,""label"":""outcome"",""startOffset"":252},{""endOffset"":274,""label"":""outcome"",""startOffset"":266},{""endOffset"":290,""label"":""outcome"",""startOffset"":276}]}}]"
sea99q,t5_2syer,I assume this is to mitigate any pain from flare-ups caused by the Allo,"[{""crowd-entity-annotation"":{""entities"":[{""endOffset"":50,""label"":""population"",""startOffset"":44},{""endOffset"":144,""label"":""intervention"",""startOffset"":139},{""endOffset"":207,""label"":""outcome"",""startOffset"":181},{""endOffset"":294,""label"":""intervention"",""startOffset"":256},{""endOffset"":367,""label"":""outcome"",""startOffset"":312},{""endOffset"":437,""label"":""intervention"",""startOffset"":424},{""endOffset"":542,""label"":""intervention"",""startOffset"":536},{""endOffset"":567,""label"":""outcome"",""startOffset"":542},{""endOffset"":580,""label"":""intervention"",""startOffset"":572}]}}]"
su4pho,t5_2s23e,"A Belgian study found no difference between brain volume loss (BVL) of healthy individuals and patients with MS (pwMS) that had no evident disease activity (no lesions), also known as NEDA-3.
","[{""crowd-entity-annotation"":{""entities"":[{""endOffset"":192,""label"":""outcome"",""startOffset"":175},{""endOffset"":221,""label"":""population"",""startOffset"":202},{""endOffset"":242,""label"":""population"",""startOffset"":240}]}}]"
rz4gzj,t5_2r876,Cystic Fibrosis Drugs Can Be Life-Changing For Patients. New Images Reveal How These Molecules Work.,"[{""crowd-entity-annotation"":{""entities"":[{""endOffset"":21,""label"":""intervention"",""startOffset"":0},{""endOffset"":42,""label"":""outcome"",""startOffset"":29},{""endOffset"":55,""label"":""population"",""startOffset"":47}]}}]"
q26mn4,t5_2syer,Artemisia annua helps with gout,"[{""crowd-entity-annotation"":{""entities"":[{""endOffset"":15,""label"":""intervention"",""startOffset"":0},{""endOffset"":31,""label"":""population"",""startOffset"":26}]}}]"
rqujl8,t5_2qlaa,"I've tried PPIs, gaviscon advance, magnesium supplements, probiotics, zinc carosine, DGL licorice, etc. But still am having constant chest and back pain and sore throats. 
","[{""crowd-entity-annotation"":{""entities"":[{""endOffset"":842,""label"":""intervention"",""startOffset"":838},{""endOffset"":860,""label"":""intervention"",""startOffset"":844},{""endOffset"":883,""label"":""intervention"",""startOffset"":862},{""endOffset"":895,""label"":""intervention"",""startOffset"":885},{""endOffset"":910,""label"":""intervention"",""startOffset"":897},{""endOffset"":924,""label"":""intervention"",""startOffset"":912},{""endOffset"":979,""label"":""outcome"",""startOffset"":960},{""endOffset"":997,""label"":""outcome"",""startOffset"":984}]}}]"
s2q0lw,t5_2s23e,Ive read Ocrevus/Kesimpta/rituxan/lemtrada users are eligible but havent seen anything about Mavenclad,"[{""crowd-entity-annotation"":{""entities"":[{""endOffset"":52,""label"":""intervention"",""startOffset"":44},{""endOffset"":70,""label"":""intervention"",""startOffset"":63},{""endOffset"":79,""label"":""intervention"",""startOffset"":71},{""endOffset"":87,""label"":""intervention"",""startOffset"":80},{""endOffset"":96,""label"":""intervention"",""startOffset"":88},{""endOffset"":156,""label"":""intervention"",""startOffset"":147}]}}]"
sv0tk2,t5_2s3g1,I heard ibs is mostly random pain attacks,"[{""crowd-entity-annotation"":{""entities"":[{""endOffset"":53,""label"":""outcome"",""startOffset"":45},{""endOffset"":192,""label"":""population"",""startOffset"":189},{""endOffset"":246,""label"":""outcome"",""startOffset"":242}]}}]"
st8v0z,t5_2s3g1,Apparently clubbed nails is a possibility with IBD/Chron's.,"[{""crowd-entity-annotation"":{""entities"":[]}}]"
sv5nh4,t5_2s3g1,"Then I went to Dr. Google, thought I had the big C and was going to die. ","[{""crowd-entity-annotation"":{""entities"":[{""endOffset"":194,""label"":""population"",""startOffset"":191},{""endOffset"":255,""label"":""outcome"",""startOffset"":249},{""endOffset"":395,""label"":""intervention"",""startOffset"":391},{""endOffset"":788,""label"":""intervention"",""startOffset"":779},{""endOffset"":971,""label"":""outcome"",""startOffset"":950},{""endOffset"":982,""label"":""outcome"",""startOffset"":974},{""endOffset"":1008,""label"":""outcome"",""startOffset"":997},{""endOffset"":1176,""label"":""outcome"",""startOffset"":1169},{""endOffset"":1188,""label"":""outcome"",""startOffset"":1179},{""endOffset"":1408,""label"":""intervention"",""startOffset"":1396},{""endOffset"":1423,""label"":""intervention"",""startOffset"":1410},{""endOffset"":1435,""label"":""intervention"",""startOffset"":1425},{""endOffset"":1457,""label"":""intervention"",""startOffset"":1440}]}}]"
p7j49y,t5_2syer,almost everything I read showed that sardines are like salmon but without the mercury and there were even articles saying daily consumption of sardines is safe,"[{""crowd-entity-annotation"":{""entities"":[{""endOffset"":229,""label"":""intervention"",""startOffset"":221},{""endOffset"":380,""label"":""population"",""startOffset"":376},{""endOffset"":1369,""label"":""intervention"",""startOffset"":1362},{""endOffset"":1375,""label"":""intervention"",""startOffset"":1371},{""endOffset"":1381,""label"":""intervention"",""startOffset"":1377},{""endOffset"":1391,""label"":""intervention"",""startOffset"":1383},{""endOffset"":1625,""label"":""population"",""startOffset"":1615},{""endOffset"":1642,""label"":""population"",""startOffset"":1630}]}}]"
s3akj3,t5_2rtve,my doctors seem to think it might resolve to some degree with treatment,"[{""crowd-entity-annotation"":{""entities"":[{""endOffset"":131,""label"":""population"",""startOffset"":127},{""endOffset"":172,""label"":""population"",""startOffset"":164},{""endOffset"":296,""label"":""population"",""startOffset"":284},{""endOffset"":410,""label"":""intervention"",""startOffset"":401}]}}]"
sqckaa,t5_2s23e," I found that according to leaflet 66% of patients have it. And only around 11% have local site reactions to Kesimpta, which is hopeful to me

","[{""crowd-entity-annotation"":{""entities"":[{""endOffset"":53,""label"":""intervention"",""startOffset"":45},{""endOffset"":96,""label"":""intervention"",""startOffset"":88},{""endOffset"":247,""label"":""intervention"",""startOffset"":238},{""endOffset"":1946,""label"":""intervention"",""startOffset"":1931},{""endOffset"":1996,""label"":""outcome"",""startOffset"":1987}]}}]"
rvgyj9,t5_2s1h9," I have read could be 6-12 months after surgery, with most saying 1 year after surgery, and you need to have 3-4 episodes.  ","[{""crowd-entity-annotation"":{""entities"":[{""endOffset"":82,""label"":""outcome"",""startOffset"":74},{""endOffset"":113,""label"":""intervention"",""startOffset"":106}]}}]"
rzva7x,t5_2s1h9,"As I think people know here in this subreddit, the anti-seizure medication has lots of side effects that affect daily life","[{""crowd-entity-annotation"":{""entities"":[{""endOffset"":1283,""label"":""intervention"",""startOffset"":1260},{""endOffset"":1308,""label"":""outcome"",""startOffset"":1296}]}}]"
s2q4jb,t5_2tyg2,My research online has actually said that this is rare and almost never happens.,"[{""crowd-entity-annotation"":{""entities"":[{""endOffset"":29,""label"":""outcome"",""startOffset"":22}]}}]"
ontwk7,t5_2syer,I think my gout is developing to chronic gout,"[{""crowd-entity-annotation"":{""entities"":[]}}]"
sr6zne,t5_2saq9,"i found we need dopamine adrenaline 
precusor is ltyrosine","[{""crowd-entity-annotation"":{""entities"":[{""endOffset"":63,""label"":""population"",""startOffset"":59},{""endOffset"":78,""label"":""population"",""startOffset"":65},{""endOffset"":190,""label"":""intervention"",""startOffset"":188},{""endOffset"":233,""label"":""intervention"",""startOffset"":218},{""endOffset"":248,""label"":""intervention"",""startOffset"":238},{""endOffset"":440,""label"":""intervention"",""startOffset"":431},{""endOffset"":460,""label"":""intervention"",""startOffset"":452},{""endOffset"":502,""label"":""intervention"",""startOffset"":497},{""endOffset"":539,""label"":""outcome"",""startOffset"":532},{""endOffset"":583,""label"":""intervention"",""startOffset"":564},{""endOffset"":757,""label"":""population"",""startOffset"":748}]}}]"
sp31m0,t5_2saq9,"Google (I knowwww I'm sorry) says it sounds like exercise induced bronchospasm or asthma, or it could be pots.","[{""crowd-entity-annotation"":{""entities"":[{""endOffset"":96,""label"":""population"",""startOffset"":87},{""endOffset"":106,""label"":""population"",""startOffset"":101},{""endOffset"":217,""label"":""outcome"",""startOffset"":213},{""endOffset"":265,""label"":""outcome"",""startOffset"":260},{""endOffset"":304,""label"":""intervention"",""startOffset"":293},{""endOffset"":331,""label"":""intervention"",""startOffset"":318},{""endOffset"":759,""label"":""population"",""startOffset"":747},{""endOffset"":769,""label"":""population"",""startOffset"":763},{""endOffset"":790,""label"":""population"",""startOffset"":786}]}}]"
rwldz4,t5_2s1h9,My boyfriend has generalized epilepsy w/grand mal,"[{""crowd-entity-annotation"":{""entities"":[]}}]"
smcq5d,t5_2rtve,My rhem pushed me off when they said its not a lupus flare and not only until I took an at home test did my pcp tell me to come in for the UA and antibiotics,"[{""crowd-entity-annotation"":{""entities"":[{""endOffset"":237,""label"":""population"",""startOffset"":232},{""endOffset"":310,""label"":""outcome"",""startOffset"":304},{""endOffset"":327,""label"":""outcome"",""startOffset"":315},{""endOffset"":361,""label"":""outcome"",""startOffset"":354},{""endOffset"":384,""label"":""outcome"",""startOffset"":375},{""endOffset"":601,""label"":""outcome"",""startOffset"":597},{""endOffset"":826,""label"":""intervention"",""startOffset"":824},{""endOffset"":842,""label"":""intervention"",""startOffset"":831}]}}]"
p46miu,t5_2syer,Its been found that only 20 percent of people with high uric acid have gout and its highly genetic,"[{""crowd-entity-annotation"":{""entities"":[{""endOffset"":344,""label"":""outcome"",""startOffset"":330},{""endOffset"":355,""label"":""population"",""startOffset"":350}]}}]"
sc9gw3,t5_2s23e,Stanford Medicine Researchers' Study identifies HOW the Epstein-Barr virus can trigger Multiple Sclerosis.,"[{""crowd-entity-annotation"":{""entities"":[{""endOffset"":74,""label"":""intervention"",""startOffset"":56},{""endOffset"":105,""label"":""population"",""startOffset"":87}]}}]"
sbroeu,t5_2saq9,i was warned that Corlanor can cause that so i called cardiology and had them send a message to my doctor because i also have a chronically high D-dimer and A Fib puts anyone at greater risk of clots.,"[{""crowd-entity-annotation"":{""entities"":[{""endOffset"":448,""label"":""outcome"",""startOffset"":443},{""endOffset"":594,""label"":""intervention"",""startOffset"":585}]}}]"
s8jc1h,t5_2s23e,"for that  MS feeling of pins jn my skin.
","[{""crowd-entity-annotation"":{""entities"":[{""endOffset"":71,""label"":""population"",""startOffset"":68},{""endOffset"":97,""label"":""outcome"",""startOffset"":82}]}}]"
qnrskm,t5_2syer,I realize its a chronic thing,"[{""crowd-entity-annotation"":{""entities"":[{""endOffset"":261,""label"":""population"",""startOffset"":256},{""endOffset"":349,""label"":""intervention"",""startOffset"":332}]}}]"
spvgbf,t5_2s23e,"So I started reading and found an association between flax seed oil and testosterone that fit:
","[{""crowd-entity-annotation"":{""entities"":[{""endOffset"":60,""label"":""population"",""startOffset"":58},{""endOffset"":173,""label"":""outcome"",""startOffset"":167},{""endOffset"":458,""label"":""intervention"",""startOffset"":455},{""endOffset"":573,""label"":""intervention"",""startOffset"":560},{""endOffset"":584,""label"":""outcome"",""startOffset"":576}]}}]"
sn4zg2,t5_2rtve,They are already not uncommon and estimated to be in 4-20% of the general population.,"[{""crowd-entity-annotation"":{""entities"":[{""endOffset"":40,""label"":""population"",""startOffset"":35},{""endOffset"":126,""label"":""outcome"",""startOffset"":108}]}}]"
sbc15d,t5_2s23e,Of course someone says that this sort of thing can happen with MS,"[{""crowd-entity-annotation"":{""entities"":[{""endOffset"":142,""label"":""outcome"",""startOffset"":133},{""endOffset"":256,""label"":""population"",""startOffset"":254}]}}]"
s9b763,t5_2saq9,"I know most of the time, you cant identify what triggered POTS","[{""crowd-entity-annotation"":{""entities"":[{""endOffset"":78,""label"":""population"",""startOffset"":74}]}}]"
pulfjv,t5_2r876,Lifechanging Treatment for Cystic Fibrosis Patients,"[{""crowd-entity-annotation"":{""entities"":[{""endOffset"":40,""label"":""outcome"",""startOffset"":27},{""endOffset"":51,""label"":""intervention"",""startOffset"":40},{""endOffset"":71,""label"":""population"",""startOffset"":54}]}}]"
rkty6n,t5_2s1h9,Theres a lot of flashing light scenes.,"[{""crowd-entity-annotation"":{""entities"":[{""endOffset"":116,""label"":""outcome"",""startOffset"":108}]}}]"
qiq2ji,t5_2r876,"This company makes a lot of lofty claims about how important their probiotic is for infants and Im tempted to buy for my 3 month old son: 

https://www.evivo.com/baby-probiotics","[{""crowd-entity-annotation"":{""entities"":[{""endOffset"":47,""label"":""intervention"",""startOffset"":36},{""endOffset"":105,""label"":""population"",""startOffset"":89}]}}]"
spduqv,t5_2r876,i know paraffin is carcinogenic and CFers are higher risk for lung cancer,"[{""crowd-entity-annotation"":{""entities"":[{""endOffset"":142,""label"":""intervention"",""startOffset"":134},{""endOffset"":168,""label"":""population"",""startOffset"":163},{""endOffset"":199,""label"":""outcome"",""startOffset"":180}]}}]"
rdnrpf,t5_2r876,I started eating sourdough because I thought it would be better than normal bread,"[{""crowd-entity-annotation"":{""entities"":[{""endOffset"":105,""label"":""population"",""startOffset"":103},{""endOffset"":402,""label"":""intervention"",""startOffset"":386},{""endOffset"":791,""label"":""outcome"",""startOffset"":770}]}}]"
qfho0k,t5_2rtve,.my rheumatologist and even dermatologist thinks it's due to sanitizer or soap,"[{""crowd-entity-annotation"":{""entities"":[{""endOffset"":36,""label"":""population"",""startOffset"":32},{""endOffset"":159,""label"":""population"",""startOffset"":154}]}}]"
p5l5ux,t5_2r876,I found out earlier this year that Im infertile due to a lack of a vas deferens,"[{""crowd-entity-annotation"":{""entities"":[{""endOffset"":54,""label"":""population"",""startOffset"":43}]}}]"
pxcj69,t5_2syer,this could be a one time thing but now with this second flare up Im not too sure.,"[{""crowd-entity-annotation"":{""entities"":[{""endOffset"":23,""label"":""population"",""startOffset"":19},{""endOffset"":712,""label"":""outcome"",""startOffset"":704}]}}]"
s3sroj,t5_2r876,"I'm in UK & from what I've read online & even on cf trust website it says, anti virals plus the blood plasma thing (sorry I'm unsure of its name) is only to be used for immunosuppressed, cf patients who has had tx, Down Syndrome & cancer. 
","[{""crowd-entity-annotation"":{""entities"":[{""endOffset"":290,""label"":""intervention"",""startOffset"":251},{""endOffset"":361,""label"":""intervention"",""startOffset"":345},{""endOffset"":413,""label"":""intervention"",""startOffset"":363}]}}]"
r6ia9m,t5_2syer,"I've further realised today, that its pretty much in the same parts of my shoulders (joint tops) that get slightly exposed (and very cold) when the duvet slips down a bit at night.","[{""crowd-entity-annotation"":{""entities"":[]}}]"
s1mdcj,t5_2tyg2,I know sleep deprivation has to be avoided as well as stress,"[{""crowd-entity-annotation"":{""entities"":[{""endOffset"":208,""label"":""population"",""startOffset"":199},{""endOffset"":316,""label"":""population"",""startOffset"":310}]}}]"
