post_id,subreddit_id,claim,stage2_labels
s1qscl,t5_2s23e,This means that my MS lesions in my brain did not cause my numbness/tingling and have not caused any symptoms yet.,"[{""crowd-entity-annotation"":{""entities"":[{""endOffset"":328,""label"":""population"",""startOffset"":326},{""endOffset"":480,""label"":""intervention"",""startOffset"":464},{""endOffset"":519,""label"":""outcome"",""startOffset"":492}]}}]"
sqoy2q,t5_2s23e,Ill start. I thought that everyone had to sit down after walking up the stairs too quickly cuz their legs would tense up and wouldnt move,"[{""crowd-entity-annotation"":{""entities"":[{""endOffset"":93,""label"":""population"",""startOffset"":90},{""endOffset"":238,""label"":""outcome"",""startOffset"":202}]}}]"
skyjkk,t5_2s3g1,My doc said 1-2 teaspoons is fine,"[{""crowd-entity-annotation"":{""entities"":[{""endOffset"":68,""label"":""intervention"",""startOffset"":59},{""endOffset"":105,""label"":""population"",""startOffset"":93},{""endOffset"":137,""label"":""outcome"",""startOffset"":130},{""endOffset"":147,""label"":""outcome"",""startOffset"":142}]}}]"
styc46,t5_2s3g1,It doesn't make sense to me because people with pancreatic insufficiency should seem malnourished.,"[{""crowd-entity-annotation"":{""entities"":[{""endOffset"":209,""label"":""population"",""startOffset"":188},{""endOffset"":235,""label"":""population"",""startOffset"":212},{""endOffset"":273,""label"":""population"",""startOffset"":239},{""endOffset"":280,""label"":""population"",""startOffset"":276},{""endOffset"":483,""label"":""outcome"",""startOffset"":473},{""endOffset"":538,""label"":""intervention"",""startOffset"":521},{""endOffset"":575,""label"":""intervention"",""startOffset"":550},{""endOffset"":607,""label"":""outcome"",""startOffset"":584},{""endOffset"":774,""label"":""intervention"",""startOffset"":750},{""endOffset"":799,""label"":""outcome"",""startOffset"":781},{""endOffset"":831,""label"":""intervention"",""startOffset"":805},{""endOffset"":1135,""label"":""intervention"",""startOffset"":1130},{""endOffset"":1146,""label"":""intervention"",""startOffset"":1137},{""endOffset"":1165,""label"":""intervention"",""startOffset"":1151},{""endOffset"":1265,""label"":""intervention"",""startOffset"":1246},{""endOffset"":1327,""label"":""outcome"",""startOffset"":1295}]}}]"
sjn0a0,t5_2s23e,I know its perfectly safe except it seems like it isnt always.,"[{""crowd-entity-annotation"":{""entities"":[{""endOffset"":95,""label"":""population"",""startOffset"":93},{""endOffset"":224,""label"":""intervention"",""startOffset"":214},{""endOffset"":320,""label"":""outcome"",""startOffset"":313}]}}]"
svxuqz,t5_2s23e,"My specialist is not convinced that what is happening right now is mechanical, which was my assumption and why I waited to report the symptoms until my arm was so weak that I couldnt really function very well","[{""crowd-entity-annotation"":{""entities"":[{""endOffset"":232,""label"":""outcome"",""startOffset"":224},{""endOffset"":699,""label"":""outcome"",""startOffset"":689},{""endOffset"":740,""label"":""outcome"",""startOffset"":736},{""endOffset"":756,""label"":""outcome"",""startOffset"":751},{""endOffset"":1276,""label"":""outcome"",""startOffset"":1269},{""endOffset"":1715,""label"":""outcome"",""startOffset"":1703},{""endOffset"":1807,""label"":""intervention"",""startOffset"":1799}]}}]"
slp6v8,t5_2tyg2," I have bipolar disorder. One of my best friends died of cancer last May. Losing her pushed me over the edge and I ended up psychotic / with delusional parasitosis. 
","[{""crowd-entity-annotation"":{""entities"":[{""endOffset"":64,""label"":""population"",""startOffset"":48},{""endOffset"":103,""label"":""population"",""startOffset"":97},{""endOffset"":173,""label"":""outcome"",""startOffset"":164}]}}]"
stnao3,t5_2s23e,"Covid has been linked to an uptick in diagnosed autoimmune cases that include MS.
This article was published by the National Institute of Health.","[{""crowd-entity-annotation"":{""entities"":[{""endOffset"":80,""label"":""population"",""startOffset"":78},{""endOffset"":318,""label"":""intervention"",""startOffset"":307}]}}]"
sl28vd,t5_2s3g1,"My doctor recently told me that they have found that theres a link between the two,","[{""crowd-entity-annotation"":{""entities"":[{""endOffset"":59,""label"":""population"",""startOffset"":56},{""endOffset"":83,""label"":""population"",""startOffset"":80}]}}]"
sq9fov,t5_2s3g1,Okay so I made this post saying how people should not make jokes and above all not make fun of others about specifically ibs. People did not like that I did it.,"[{""crowd-entity-annotation"":{""entities"":[{""endOffset"":124,""label"":""population"",""startOffset"":121}]}}]"
sewoia,t5_2rtve,I believe as though Im experiencing classic early signs of LN onset,"[{""crowd-entity-annotation"":{""entities"":[{""endOffset"":86,""label"":""population"",""startOffset"":84},{""endOffset"":99,""label"":""outcome"",""startOffset"":94},{""endOffset"":136,""label"":""outcome"",""startOffset"":128},{""endOffset"":150,""label"":""outcome"",""startOffset"":147},{""endOffset"":185,""label"":""outcome"",""startOffset"":174},{""endOffset"":193,""label"":""outcome"",""startOffset"":187}]}}]"
s48doq,t5_2tyg2,so i recently read that adderall can trigger a psychotic break,"[{""crowd-entity-annotation"":{""entities"":[{""endOffset"":55,""label"":""intervention"",""startOffset"":47},{""endOffset"":240,""label"":""population"",""startOffset"":231}]}}]"
rh5ety,t5_2qlaa,"I know its not good to do this but of course I looked for other peoples opinions and experiences and Ive seen people saying they got worse after surgery, or that the pain was unbearable and they werent normal for months and months afterward.","[{""crowd-entity-annotation"":{""entities"":[{""endOffset"":149,""label"":""population"",""startOffset"":140},{""endOffset"":172,""label"":""population"",""startOffset"":159},{""endOffset"":214,""label"":""intervention"",""startOffset"":199}]}}]"
rnbnwm,t5_2qlaa,however after doing some research the pantoprazole drug it seems to be more for the severe symptoms in which i dont think i have,"[{""crowd-entity-annotation"":{""entities"":[{""endOffset"":31,""label"":""intervention"",""startOffset"":14},{""endOffset"":218,""label"":""outcome"",""startOffset"":205},{""endOffset"":533,""label"":""outcome"",""startOffset"":511}]}}]"
s04wzo,t5_2s1h9,Lions Mane mushroom is this funny white blob of funny white tendrils. Looks really cool and is claimed to be good for the brain cells,"[{""crowd-entity-annotation"":{""entities"":[{""endOffset"":84,""label"":""intervention"",""startOffset"":65},{""endOffset"":278,""label"":""population"",""startOffset"":267}]}}]"
r4fm4z,t5_2r876,people whose life expectancies have changed drastically in the past few years due to Trikafta/Kaftrio.,"[{""crowd-entity-annotation"":{""entities"":[{""endOffset"":32,""label"":""population"",""startOffset"":30},{""endOffset"":96,""label"":""intervention"",""startOffset"":80}]}}]"
rlic6x,t5_2qlaa,I read something about how Pantoprazole has some long term effects on your body that honestly arent too stellar,"[{""crowd-entity-annotation"":{""entities"":[{""endOffset"":370,""label"":""intervention"",""startOffset"":357}]}}]"
rdnm5n,t5_2syer,"Sugar and refined carbs also cause dehydration, which in turn, promotes the buildup of uric acid.","[{""crowd-entity-annotation"":{""entities"":[{""endOffset"":972,""label"":""intervention"",""startOffset"":966},{""endOffset"":989,""label"":""intervention"",""startOffset"":976},{""endOffset"":1012,""label"":""outcome"",""startOffset"":1001},{""endOffset"":1063,""label"":""outcome"",""startOffset"":1053}]}}]"
srdurq,t5_2s3g1," Ive taken it with lactic acid bacteria, because I read some research that the two may have synergetic effect.","[{""crowd-entity-annotation"":{""entities"":[{""endOffset"":135,""label"":""intervention"",""startOffset"":126},{""endOffset"":279,""label"":""intervention"",""startOffset"":259},{""endOffset"":560,""label"":""outcome"",""startOffset"":549}]}}]"
sogmrv,t5_2s23e,"Pasithea Therapeutics announced plans to develop a tolerizing vaccine that would treat multiple sclerosis by training the immune system in ways that prevent its damaging attacks. The research will be led by Lawrence Steinman, MD, Pasitheas chairman and a Stanford University professor of neuro.","[{""crowd-entity-annotation"":{""entities"":[{""endOffset"":69,""label"":""intervention"",""startOffset"":51},{""endOffset"":105,""label"":""population"",""startOffset"":96},{""endOffset"":748,""label"":""intervention"",""startOffset"":731}]}}]"
rng9kg,t5_2s1h9,if they are still using traditional lithium ion then there is a possibility that in the near future the RNS will be a one time surgery instead of needing to go under the knife every 5-10 years,"[{""crowd-entity-annotation"":{""entities"":[{""endOffset"":240,""label"":""intervention"",""startOffset"":236}]}}]"
st9ogm,t5_2s3g1,I also have constipation which I think is the root cause of my issues and causes a massive bought of diarrhea after. Its hard for me to determine what is constipating me because it can take a few days for the hard stool to appear after the trigger,"[{""crowd-entity-annotation"":{""entities"":[{""endOffset"":523,""label"":""population"",""startOffset"":510},{""endOffset"":608,""label"":""outcome"",""startOffset"":599}]}}]"
quv4rn,t5_2rtve,Lupus causes plenty of dental and oral health issues,"[{""crowd-entity-annotation"":{""entities"":[{""endOffset"":49,""label"":""intervention"",""startOffset"":43},{""endOffset"":96,""label"":""outcome"",""startOffset"":66},{""endOffset"":174,""label"":""intervention"",""startOffset"":140},{""endOffset"":483,""label"":""outcome"",""startOffset"":437}]}}]"
rzcg5n,t5_2rtve,"But more importantly, learn how to decrease stress to help lower the risk of flares","[{""crowd-entity-annotation"":{""entities"":[]}}]"
s9xo11,t5_2s23e,"My MS diagnosis was prompted by one of these: one fine day a colorful flickering blotch appeared in my field of vision, both eyes, preventing me from reading correctly. It disappeared within minutes, and soon after I got a splitting headache that knocked me out for the rest of the day. When I recovered that evening, I first noticed I had Lhermitte's sign, which led to my MS diagnosis.","[{""crowd-entity-annotation"":{""entities"":[{""endOffset"":405,""label"":""outcome"",""startOffset"":389},{""endOffset"":426,""label"":""population"",""startOffset"":423}]}}]"
poursf,t5_2syer,"if you take a creatine supplement and you experience gout, you need to cease the supplementation and discuss it with your doctor.","[{""crowd-entity-annotation"":{""entities"":[{""endOffset"":17,""label"":""population"",""startOffset"":13},{""endOffset"":268,""label"":""intervention"",""startOffset"":258},{""endOffset"":301,""label"":""intervention"",""startOffset"":279},{""endOffset"":366,""label"":""outcome"",""startOffset"":362}]}}]"
rgzh3w,t5_2s1h9,Whole plant cannabis cuts seizures by 86% in epileptic children,"[{""crowd-entity-annotation"":{""entities"":[{""endOffset"":20,""label"":""intervention"",""startOffset"":12},{""endOffset"":34,""label"":""population"",""startOffset"":26}]}}]"
rfr5ul,t5_2qlaa,I really didn't want to take an SSRI because of the sexual dysfunction thing. SSRIs and SNRIs seem to have the highest prevalence of sexual dysfunction reported out of antidepressants.,"[{""crowd-entity-annotation"":{""entities"":[{""endOffset"":781,""label"":""intervention"",""startOffset"":775},{""endOffset"":791,""label"":""intervention"",""startOffset"":785},{""endOffset"":848,""label"":""outcome"",""startOffset"":830}]}}]"
r6g35n,t5_2rtve,I know obviously ulcers are common in lupies,"[{""crowd-entity-annotation"":{""entities"":[{""endOffset"":65,""label"":""population"",""startOffset"":59},{""endOffset"":86,""label"":""population"",""startOffset"":80}]}}]"
s7660h,t5_2s23e,Poll Results: The Top 6 Most Common Symptoms Shared by MyMSTeam Members,"[{""crowd-entity-annotation"":{""entities"":[]}}]"
se3cpd,t5_2saq9,"They are still doing research on this, but I found what they know so far to be really interesting:


>A novel therapy, testedex vivo, has been successful at correcting the dysfunctional body mechanism inPostural Orthostatic Tachycardia Syndrome (POTS).

>Researchers have discovered how genes that protect against Postural Orthostatic Tachycardia Syndrome (POTS) become silent or switched off and have identified a drug to switch them on again.

>POTS is one of a group of disorders that have orthostatic intolerance as their primary symptom, in which a reduced volume of blood returns to the heart after the person stands up from a lying-down position. A main symptom in a third of POTS patients is fainting.

>The researchers were fromMonash Universityand led by Professor Sam El-Osta who said that while the gene implicated in POTS norepinephrinetransporter (NET)  had been known for several decades, past research had failed to find a genetic mutation responsible for the symptoms. This latest study revealed that the enzyme EZH2 is responsible for silencing this gene.

","[{""crowd-entity-annotation"":{""entities"":[{""endOffset"":25,""label"":""population"",""startOffset"":21},{""endOffset"":1098,""label"":""intervention"",""startOffset"":1092}]}}]"
px14lk,t5_2syer,It seems like that is the only meat I can eat without having a gout flare up,"[{""crowd-entity-annotation"":{""entities"":[{""endOffset"":28,""label"":""intervention"",""startOffset"":13},{""endOffset"":106,""label"":""outcome"",""startOffset"":76}]}}]"
qyfer0,t5_2syer,If you're taking Lisinopril make sure you do not take Indomethacin together.,"[{""crowd-entity-annotation"":{""entities"":[{""endOffset"":170,""label"":""intervention"",""startOffset"":158},{""endOffset"":208,""label"":""intervention"",""startOffset"":195},{""endOffset"":262,""label"":""outcome"",""startOffset"":229},{""endOffset"":461,""label"":""outcome"",""startOffset"":404}]}}]"
smufl5,t5_2s3g1,Simply focusing on relaxing and breathing into your stomach really helps.,"[{""crowd-entity-annotation"":{""entities"":[{""endOffset"":453,""label"":""population"",""startOffset"":450}]}}]"
sn9xup,t5_2s3g1,"Overlap between irritable bowel syndrome and common gastrointestinal diagnoses: a retrospective cohort study of 29,553 outpatients in Germany","[{""crowd-entity-annotation"":{""entities"":[{""endOffset"":40,""label"":""population"",""startOffset"":16},{""endOffset"":78,""label"":""population"",""startOffset"":45}]}}]"
sq9xot,t5_2s3g1,"i read that it can be caused by ibs, ulcerative colitis or ibd but my doctor isnt taking me seriously and im slightly concerned because idk","[{""crowd-entity-annotation"":{""entities"":[{""endOffset"":64,""label"":""population"",""startOffset"":61},{""endOffset"":139,""label"":""population"",""startOffset"":121},{""endOffset"":146,""label"":""population"",""startOffset"":143}]}}]"
pf8bbr,t5_2syer,I've read that IF is good for reducing inflammation in the body,"[{""crowd-entity-annotation"":{""entities"":[{""endOffset"":21,""label"":""intervention"",""startOffset"":0},{""endOffset"":35,""label"":""population"",""startOffset"":31},{""endOffset"":201,""label"":""outcome"",""startOffset"":179}]}}]"
sp01x6,t5_2saq9,"Upon research, I discovered Thoracoscopic Sympathectomies are successfully used as a Raynauds treatment (also for hyperhidrosis). I know this procedure is targeted at the nervous system so was curious if it has ever come up in regards to treating POTS.","[{""crowd-entity-annotation"":{""entities"":[{""endOffset"":91,""label"":""population"",""startOffset"":86},{""endOffset"":150,""label"":""intervention"",""startOffset"":121},{""endOffset"":220,""label"":""population"",""startOffset"":207}]}}]"
r1gt21,t5_2syer,I know gout can be triggered by trauma and recently I sprained my ankle hiking,"[{""crowd-entity-annotation"":{""entities"":[{""endOffset"":51,""label"":""outcome"",""startOffset"":46},{""endOffset"":110,""label"":""intervention"",""startOffset"":93}]}}]"
slchrm,t5_2s3g1,Positive allosteric modulation of endogenous delta opioid receptor signaling in the enteric nervous system is a potential treatment for gastrointestinal motility disorders,"[{""crowd-entity-annotation"":{""entities"":[{""endOffset"":107,""label"":""intervention"",""startOffset"":0},{""endOffset"":172,""label"":""population"",""startOffset"":135}]}}]"
qxfzl4,t5_2rtve,I don't consider myself to currently have any lung involvement,"[{""crowd-entity-annotation"":{""entities"":[{""endOffset"":132,""label"":""population"",""startOffset"":122},{""endOffset"":228,""label"":""outcome"",""startOffset"":217}]}}]"
rowlm8,t5_2s1h9,The use of whole-plant cannabis extracts of varying potencies is effective in reducing seizure frequency in pediatric patients with intractable epilepsy,"[{""crowd-entity-annotation"":{""entities"":[{""endOffset"":40,""label"":""intervention"",""startOffset"":11},{""endOffset"":104,""label"":""outcome"",""startOffset"":87},{""endOffset"":152,""label"":""population"",""startOffset"":108}]}}]"
se4ywh,t5_2s23e,"I've read that type 1 and 2 bands indicate  MS, I've also read that 95% of MS diagnoses have oligoclonal bands.","[{""crowd-entity-annotation"":{""entities"":[]}}]"
svltqv,t5_2s3g1,"Lately I've been looking into other types of medicines I could take, mostly I want the stomach pain and bloating to stop because I have it so often, but every time I find a pill I want to try, I research it and I see people saying it made their IBS worse/gave them a flare-up. Granted, I also see some who have had success with these medications, but the former makes me too afraid to try anything.","[{""crowd-entity-annotation"":{""entities"":[{""endOffset"":64,""label"":""population"",""startOffset"":54},{""endOffset"":158,""label"":""intervention"",""startOffset"":151},{""endOffset"":169,""label"":""intervention"",""startOffset"":159},{""endOffset"":247,""label"":""intervention"",""startOffset"":234},{""endOffset"":519,""label"":""outcome"",""startOffset"":498},{""endOffset"":540,""label"":""outcome"",""startOffset"":530},{""endOffset"":703,""label"":""intervention"",""startOffset"":696},{""endOffset"":741,""label"":""intervention"",""startOffset"":725},{""endOffset"":764,""label"":""intervention"",""startOffset"":748},{""endOffset"":817,""label"":""intervention"",""startOffset"":807},{""endOffset"":834,""label"":""intervention"",""startOffset"":822}]}}]"
s5ld0k,t5_2saq9,Ive heard of several people with POTS having their babies a little early but couldnt find any journal articles on it.,"[{""crowd-entity-annotation"":{""entities"":[{""endOffset"":115,""label"":""population"",""startOffset"":111},{""endOffset"":450,""label"":""outcome"",""startOffset"":441}]}}]"
q4473a,t5_2r876,"After doing a deep dive on Google (which is awful at anytime, but especially when you are pregnant) I found that 1 in 25 caucasians are a carrier for a CF mutation.","[{""crowd-entity-annotation"":{""entities"":[]}}]"
rh1qvs,t5_2s1h9,Covid is a lung disease. Everything Ive read says it affects the neurological and circulatory systems.,"[{""crowd-entity-annotation"":{""entities"":[{""endOffset"":296,""label"":""population"",""startOffset"":290},{""endOffset"":391,""label"":""outcome"",""startOffset"":355}]}}]"
rydjw0,t5_2s23e,"We are getting closer to prove that EBV causes/triggers MS
Source: *Prof. Gavin Giovannonis Blog* [*Read here*](https://preventiveneurology.substack.com/p/are-we-one-step-closer-to-proving?token=eyJ1c2VyX2lkIjo0MTI3ODAxMCwicG9zdF9pZCI6NDY3NjU3MDAsIl8iOiJCcHAzYiIsImlhdCI6MTY0MTU3Nzc4NiwiZXhwIjoxNjQxNTgxMzg2LCJpc3MiOiJwdWItNDA1NjA5Iiwic3ViIjoicG9zdC1yZWFjdGlvbiJ9.CBrbAtZvFHg3JOB-N_Qfev81ehTDgNt9MqwMFsGhFE0)
","[{""crowd-entity-annotation"":{""entities"":[]}}]"
s08ztu,t5_2rtve,Global spread of autoimmune disease blamed on western diet,"[{""crowd-entity-annotation"":{""entities"":[{""endOffset"":35,""label"":""outcome"",""startOffset"":17},{""endOffset"":58,""label"":""intervention"",""startOffset"":46}]}}]"
spvgbf,t5_2s23e,"Also its discussed at length in setting of PCOS at https://www.ncbi.nlm.nih.gov/pmc/articles/PMC2752973/
","[{""crowd-entity-annotation"":{""entities"":[{""endOffset"":60,""label"":""population"",""startOffset"":58},{""endOffset"":100,""label"":""population"",""startOffset"":88},{""endOffset"":458,""label"":""outcome"",""startOffset"":455},{""endOffset"":573,""label"":""intervention"",""startOffset"":560},{""endOffset"":584,""label"":""intervention"",""startOffset"":576},{""endOffset"":861,""label"":""intervention"",""startOffset"":853},{""endOffset"":873,""label"":""outcome"",""startOffset"":863},{""endOffset"":921,""label"":""outcome"",""startOffset"":915},{""endOffset"":1636,""label"":""intervention"",""startOffset"":1628}]}}]"
s1bzyk,t5_2s23e,I know MS is a neurological disease and not transferable like a cold or STD would.,"[{""crowd-entity-annotation"":{""entities"":[{""endOffset"":337,""label"":""population"",""startOffset"":334}]}}]"
sd8thh,t5_2saq9,"I was hoping yall could maybe suggest some helmets that are somewhat stylish bc not only do I faint a lot, butIm also vain.","[{""crowd-entity-annotation"":{""entities"":[]}}]"
st3b1w,t5_2s3g1,"Dr Ruscio recommends a triple probiotic approach using: lacto-Bifido, soil based and Saccharomyces Boulardii","[{""crowd-entity-annotation"":{""entities"":[{""endOffset"":25,""label"":""intervention"",""startOffset"":15},{""endOffset"":101,""label"":""population"",""startOffset"":96},{""endOffset"":154,""label"":""intervention"",""startOffset"":124},{""endOffset"":516,""label"":""intervention"",""startOffset"":493}]}}]"
s69srg,t5_2s23e,Because I have read many many people with my condition say it helps them stay awake in the morning and throughout the day,"[{""crowd-entity-annotation"":{""entities"":[{""endOffset"":73,""label"":""population"",""startOffset"":35},{""endOffset"":204,""label"":""intervention"",""startOffset"":196},{""endOffset"":304,""label"":""outcome"",""startOffset"":279}]}}]"
s9mudh,t5_2rtve,I do want to be on some kind of birth control eventually and the only option I'm really seeing at this point is the copper IUD as its the only one that is no hormone.,"[{""crowd-entity-annotation"":{""entities"":[{""endOffset"":60,""label"":""outcome"",""startOffset"":52},{""endOffset"":149,""label"":""outcome"",""startOffset"":141},{""endOffset"":503,""label"":""intervention"",""startOffset"":493}]}}]"
rrmokf,t5_2rtve,"New internalist thinks I don't have lupus or raynauds, after a different internalist diagnosed me earlier this year.","[{""crowd-entity-annotation"":{""entities"":[{""endOffset"":41,""label"":""population"",""startOffset"":36},{""endOffset"":53,""label"":""population"",""startOffset"":45},{""endOffset"":153,""label"":""outcome"",""startOffset"":149},{""endOffset"":163,""label"":""outcome"",""startOffset"":158},{""endOffset"":299,""label"":""intervention"",""startOffset"":292},{""endOffset"":357,""label"":""intervention"",""startOffset"":339},{""endOffset"":538,""label"":""outcome"",""startOffset"":530},{""endOffset"":546,""label"":""outcome"",""startOffset"":540},{""endOffset"":619,""label"":""outcome"",""startOffset"":615},{""endOffset"":658,""label"":""outcome"",""startOffset"":652},{""endOffset"":1142,""label"":""population"",""startOffset"":1133},{""endOffset"":1192,""label"":""outcome"",""startOffset"":1187}]}}]"
rtzsrf,t5_2syer,I think this was definitely a result of my body reacting to COVID,"[{""crowd-entity-annotation"":{""entities"":[{""endOffset"":751,""label"":""population"",""startOffset"":746}]}}]"
s7x2op,t5_2s23e,this study has shown that hydroxychloroquine could help slow down the disability progression of PPMS,"[{""crowd-entity-annotation"":{""entities"":[{""endOffset"":18,""label"":""intervention"",""startOffset"":0},{""endOffset"":110,""label"":""population"",""startOffset"":92},{""endOffset"":450,""label"":""population"",""startOffset"":446},{""endOffset"":1990,""label"":""population"",""startOffset"":1988}]}}]"
sssry8,t5_2s3g1,This is a super cringy video I saw on Tiktok but its helped me some so I thought I would share,"[{""crowd-entity-annotation"":{""entities"":[]}}]"
si216z,t5_2tyg2,One Does Not Simply Recover from Psychosis,"[{""crowd-entity-annotation"":{""entities"":[{""endOffset"":42,""label"":""population"",""startOffset"":33}]}}]"
sv66ww,t5_2saq9," I found pots care, but I am not sure if it is legit?","[{""crowd-entity-annotation"":{""entities"":[{""endOffset"":4,""label"":""population"",""startOffset"":0},{""endOffset"":146,""label"":""intervention"",""startOffset"":133},{""endOffset"":156,""label"":""intervention"",""startOffset"":148},{""endOffset"":173,""label"":""intervention"",""startOffset"":160}]}}]"
swbz0r,t5_2s3g1,getting a card so I can get some marijuana to help me with my IBS pains,"[{""crowd-entity-annotation"":{""entities"":[{""endOffset"":48,""label"":""intervention"",""startOffset"":39},{""endOffset"":61,""label"":""population"",""startOffset"":58},{""endOffset"":304,""label"":""population"",""startOffset"":298}]}}]"
rejq3y,t5_2s1h9,I'm T1D and my blood sugars went low.,"[{""crowd-entity-annotation"":{""entities"":[]}}]"
rfr5ul,t5_2qlaa,"- Mirtazipine (I know weight gain is an issue with this but I've always struggled to put on weight so that doesn't really bother me)
","[{""crowd-entity-annotation"":{""entities"":[{""endOffset"":1513,""label"":""intervention"",""startOffset"":1501},{""endOffset"":1532,""label"":""outcome"",""startOffset"":1521}]}}]"
pszrw9,t5_2syer,I found something on YouTube which talked about inflammation being the main culprit behind gout flare ups.,"[{""crowd-entity-annotation"":{""entities"":[{""endOffset"":291,""label"":""intervention"",""startOffset"":278},{""endOffset"":326,""label"":""population"",""startOffset"":321},{""endOffset"":335,""label"":""outcome"",""startOffset"":326}]}}]"
