post_id,subreddit_id,claim,stage2_labels
stnao3,t5_2s23e,"So, confirmation on virus exposure contributes to MS in the general public.  Also, to me, the uptick in the number of new cases on this sub.","[{""crowd-entity-annotation"":{""entities"":[{""endOffset"":5,""label"":""population"",""startOffset"":0},{""endOffset"":80,""label"":""population"",""startOffset"":78}]}}]"
ory7iy,t5_2r876,"
When I read online, i allways find - YOU CANT TAKE TO MANY.
","[{""crowd-entity-annotation"":{""entities"":[{""endOffset"":48,""label"":""intervention"",""startOffset"":41}]}}]"
ri19hq,t5_2s1h9,"shes said that typically its used to treat absence seizures, which I dont have, but has seen it work wonders on generalized epilepsy patients","[{""crowd-entity-annotation"":{""entities"":[{""endOffset"":78,""label"":""intervention"",""startOffset"":65},{""endOffset"":399,""label"":""population"",""startOffset"":370}]}}]"
swtp2i,t5_2tyg2,this is a good coping mechanism,"[{""crowd-entity-annotation"":{""entities"":[]}}]"
rf078o,t5_2rtve,"Sjgrens causes dry eyes, dry mouth, and dry skin.","[{""crowd-entity-annotation"":{""entities"":[]}}]"
s1ln7i,t5_2s23e,"Fast forward some months and these symptoms passed for the most part except I would still occasionally wake up with the pain/numbness in my hands. But a couple months ago I woke up feeling like I was having extremely shallow breathing. My ears were ringing, I felt nauseous, dizzy, and like I was going to pass out. But mostly I just felt like even though I knew I was breathing there wasnt air coming in. It was bizarre and terrifying. Also, my tongue felt numb","[{""crowd-entity-annotation"":{""entities"":[]}}]"
p9c2hv,t5_2syer,i heard flair ups are more frequent at the first time you take allo,"[{""crowd-entity-annotation"":{""entities"":[{""endOffset"":28,""label"":""intervention"",""startOffset"":17},{""endOffset"":80,""label"":""population"",""startOffset"":76},{""endOffset"":356,""label"":""outcome"",""startOffset"":344},{""endOffset"":485,""label"":""outcome"",""startOffset"":425}]}}]"
spvgbf,t5_2s23e,"Flax seed oil reduces relapses by 60% according to this study by Dr Jelinik (of OMS diet):
","[{""crowd-entity-annotation"":{""entities"":[{""endOffset"":60,""label"":""population"",""startOffset"":58},{""endOffset"":173,""label"":""outcome"",""startOffset"":167},{""endOffset"":458,""label"":""intervention"",""startOffset"":455},{""endOffset"":573,""label"":""intervention"",""startOffset"":560},{""endOffset"":584,""label"":""intervention"",""startOffset"":576},{""endOffset"":2496,""label"":""intervention"",""startOffset"":2489}]}}]"
s2ii7f,t5_2tyg2,He said he got damaged once by a 156mg shot.,"[{""crowd-entity-annotation"":{""entities"":[]}}]"
sp8tz8,t5_2tyg2,"i'm being asessed by my doctors after recently experiencing psychotic symptoms, they believe it could be anxiety induced but they aren't entirely sure","[{""crowd-entity-annotation"":{""entities"":[{""endOffset"":197,""label"":""population"",""startOffset"":189},{""endOffset"":328,""label"":""population"",""startOffset"":314}]}}]"
sj6m31,t5_2syer,I am thinking as a side effect of the other medicine.,"[{""crowd-entity-annotation"":{""entities"":[{""endOffset"":1199,""label"":""intervention"",""startOffset"":1171},{""endOffset"":1313,""label"":""outcome"",""startOffset"":1300},{""endOffset"":1322,""label"":""outcome"",""startOffset"":1318}]}}]"
sbx2ei,t5_2s23e,"I've done searches here, and see responses on both ends.","[{""crowd-entity-annotation"":{""entities"":[]}}]"
ry91p7,t5_2qlaa,"any of that.

I don't take NSAIDs as I read that can cause s","[{""crowd-entity-annotation"":{""entities"":[{""endOffset"":1953,""label"":""intervention"",""startOffset"":1946},{""endOffset"":1992,""label"":""outcome"",""startOffset"":1978}]}}]"
rjoaop,t5_2qlaa,"But the more I read up on it, there doesnt seem to be a cure","[{""crowd-entity-annotation"":{""entities"":[{""endOffset"":68,""label"":""outcome"",""startOffset"":57}]}}]"
sdgfb1,t5_2saq9,The only answer ive been told is you cannot drink or eat 4 hours prior to the test,"[{""crowd-entity-annotation"":{""entities"":[{""endOffset"":134,""label"":""population"",""startOffset"":122},{""endOffset"":173,""label"":""population"",""startOffset"":169},{""endOffset"":472,""label"":""intervention"",""startOffset"":462}]}}]"
rvwld9,t5_2s1h9,"Lamictal also seems to have a heart warning. 
","[{""crowd-entity-annotation"":{""entities"":[{""endOffset"":596,""label"":""intervention"",""startOffset"":587},{""endOffset"":630,""label"":""outcome"",""startOffset"":617}]}}]"
rf078o,t5_2rtve,Many lupus patients have Sjgrens disease along with their lupus,"[{""crowd-entity-annotation"":{""entities"":[{""endOffset"":74,""label"":""outcome"",""startOffset"":69},{""endOffset"":84,""label"":""outcome"",""startOffset"":76},{""endOffset"":103,""label"":""population"",""startOffset"":98},{""endOffset"":164,""label"":""outcome"",""startOffset"":156}]}}]"
rndmd5,t5_2s1h9,I read all these studies about its use in pregnancy and the development of autism and other cognitive disorders.,"[{""crowd-entity-annotation"":{""entities"":[{""endOffset"":104,""label"":""population"",""startOffset"":81},{""endOffset"":149,""label"":""intervention"",""startOffset"":140},{""endOffset"":326,""label"":""outcome"",""startOffset"":275}]}}]"
svoqw8,t5_2s23e,"Study with Twins Untangles Environmental and Genetic Influences on MS
","[{""crowd-entity-annotation"":{""entities"":[{""endOffset"":69,""label"":""population"",""startOffset"":67},{""endOffset"":109,""label"":""population"",""startOffset"":90},{""endOffset"":197,""label"":""outcome"",""startOffset"":155},{""endOffset"":276,""label"":""intervention"",""startOffset"":254}]}}]"
syri5a,t5_2syer,Not the big drop in uric acid that we've been hoping for,"[{""crowd-entity-annotation"":{""entities"":[{""endOffset"":36,""label"":""intervention"",""startOffset"":31},{""endOffset"":140,""label"":""outcome"",""startOffset"":130}]}}]"
oos1c2,t5_2r876,Think it could be due to trikafta.,"[{""crowd-entity-annotation"":{""entities"":[{""endOffset"":33,""label"":""outcome"",""startOffset"":18},{""endOffset"":46,""label"":""outcome"",""startOffset"":37},{""endOffset"":88,""label"":""intervention"",""startOffset"":80}]}}]"
rllm85,t5_2qlaa,I keep reading that adding a probiotic can be helpful for people with GERD,"[{""crowd-entity-annotation"":{""entities"":[{""endOffset"":50,""label"":""intervention"",""startOffset"":40},{""endOffset"":85,""label"":""population"",""startOffset"":81}]}}]"
r4fm4z,t5_2r876,Anecdotally I have heard that some people can become very depressed,"[{""crowd-entity-annotation"":{""entities"":[{""endOffset"":32,""label"":""population"",""startOffset"":30},{""endOffset"":96,""label"":""intervention"",""startOffset"":80},{""endOffset"":346,""label"":""outcome"",""startOffset"":337}]}}]"
svltqv,t5_2s3g1,"Things I've looked into include IBgard, Colpermin and other peppermint pills, other antispasmodics like Bentyl, Digestive Advantage and other probiotics, and painkillers.","[{""crowd-entity-annotation"":{""entities"":[{""endOffset"":703,""label"":""intervention"",""startOffset"":697},{""endOffset"":715,""label"":""intervention"",""startOffset"":705},{""endOffset"":741,""label"":""intervention"",""startOffset"":725},{""endOffset"":775,""label"":""intervention"",""startOffset"":769},{""endOffset"":796,""label"":""intervention"",""startOffset"":777},{""endOffset"":817,""label"":""intervention"",""startOffset"":807},{""endOffset"":834,""label"":""intervention"",""startOffset"":823}]}}]"
secu78,t5_2saq9,I know an ECG cant rule out everything and with my symptoms getting worse,"[{""crowd-entity-annotation"":{""entities"":[{""endOffset"":54,""label"":""population"",""startOffset"":49},{""endOffset"":138,""label"":""intervention"",""startOffset"":128},{""endOffset"":176,""label"":""outcome"",""startOffset"":159}]}}]"
ruqfnt,t5_2s1h9,My neurologist said that the seizure was most likely caused by covid because the other two ive had were both caused by vaping and i handt had one since march 2021 before last night.,"[{""crowd-entity-annotation"":{""entities"":[{""endOffset"":141,""label"":""outcome"",""startOffset"":133},{""endOffset"":173,""label"":""population"",""startOffset"":167},{""endOffset"":230,""label"":""intervention"",""startOffset"":223}]}}]"
so5yjv,t5_2syer,I went to the clinic again and they now suspect gout and I'm having blood work done,"[{""crowd-entity-annotation"":{""entities"":[]}}]"
snnixa,t5_2syer,Ive read that Allo can cause flare ups at first,"[{""crowd-entity-annotation"":{""entities"":[{""endOffset"":515,""label"":""intervention"",""startOffset"":510},{""endOffset"":534,""label"":""outcome"",""startOffset"":525}]}}]"
sai8d9,t5_2s23e,"This 4th shot is technically considered an actual booster since three shots is now considered to be a primary vaccine series for immunocompromised/immunosuppressed people (Source: https://www.cdc.gov/coronavirus/2019-ncov/vaccines/recommendations/immuno.html)
","[{""crowd-entity-annotation"":{""entities"":[{""endOffset"":21,""label"":""intervention"",""startOffset"":14},{""endOffset"":844,""label"":""intervention"",""startOffset"":836}]}}]"
qdkh8k,t5_2r876,Im aware oxygen tanks are a thing but that seems like a hassle and Im guessing its only necessary at a much lower lung function?,"[{""crowd-entity-annotation"":{""entities"":[{""endOffset"":385,""label"":""intervention"",""startOffset"":373}]}}]"
rtp06t,t5_2syer,Allopurinol works,"[{""crowd-entity-annotation"":{""entities"":[{""endOffset"":12,""label"":""intervention"",""startOffset"":0},{""endOffset"":91,""label"":""population"",""startOffset"":87},{""endOffset"":313,""label"":""outcome"",""startOffset"":309}]}}]"
spt6yl,t5_2s23e,"Artificial anti-Covid monoclonal antibodies that might well replace some of the immunity I lack due to Ocrevus eliminating all my B-cells. It's now available, though in short supply, and it might make life with Omicron just a little less hazardous. Anyone with MS medication immune deficiency qualifies, and protection is estimated to last 6 months. Supply varies greatly from state to state, but it can be surprisingly available if you go after it. It is the first *pre-exposure* anti-body treatment approved.","[{""crowd-entity-annotation"":{""entities"":[{""endOffset"":171,""label"":""intervention"",""startOffset"":163},{""endOffset"":197,""label"":""outcome"",""startOffset"":190}]}}]"
rt5nx7,t5_2qlaa,"December 5th I accidently ate guacamole that had jalapeos in it and have been suffering ever since(mind you I was on nexium 40mg at the time):
Burning back pain 
Throat burning 
Clogged ears 
Voice hoarseness
","[{""crowd-entity-annotation"":{""entities"":[{""endOffset"":1025,""label"":""intervention"",""startOffset"":1018}]}}]"
p8ozoq,t5_2syer,I am certain it is gout,"[{""crowd-entity-annotation"":{""entities"":[]}}]"
sb65mc,t5_2r876,"If so, is it a good idea","[{""crowd-entity-annotation"":{""entities"":[{""endOffset"":30,""label"":""intervention"",""startOffset"":19},{""endOffset"":62,""label"":""outcome"",""startOffset"":58}]}}]"
ss1qxg,t5_2s23e,"I just pulled up a site that compared these 2 drugs and was really angry to see that copaxone patients reported it caused depression, anxiety, and other things the doctor never mentioned.","[{""crowd-entity-annotation"":{""entities"":[{""endOffset"":436,""label"":""intervention"",""startOffset"":427},{""endOffset"":474,""label"":""outcome"",""startOffset"":464},{""endOffset"":483,""label"":""outcome"",""startOffset"":476}]}}]"
ryyz5d,t5_2syer,its absolutely killer and I want to know how its progressed for others and what you noticed happening,"[{""crowd-entity-annotation"":{""entities"":[{""endOffset"":13,""label"":""population"",""startOffset"":9}]}}]"
sle20q,t5_2s3g1,I think its mental since I am anxious when I poop and straining myself,"[{""crowd-entity-annotation"":{""entities"":[{""endOffset"":406,""label"":""outcome"",""startOffset"":399},{""endOffset"":446,""label"":""outcome"",""startOffset"":439},{""endOffset"":521,""label"":""outcome"",""startOffset"":510},{""endOffset"":817,""label"":""population"",""startOffset"":814},{""endOffset"":850,""label"":""intervention"",""startOffset"":840}]}}]"
p18h7e,t5_2syer,Ive seen some conflicting information regarding when to start medication,"[{""crowd-entity-annotation"":{""entities"":[{""endOffset"":87,""label"":""population"",""startOffset"":82},{""endOffset"":93,""label"":""outcome"",""startOffset"":87},{""endOffset"":228,""label"":""intervention"",""startOffset"":218}]}}]"
sb0jx1,t5_2saq9,Ive read many people online talk about how helpful saline injections are for them especially during a flare up,"[{""crowd-entity-annotation"":{""entities"":[{""endOffset"":60,""label"":""outcome"",""startOffset"":55},{""endOffset"":132,""label"":""intervention"",""startOffset"":125},{""endOffset"":153,""label"":""outcome"",""startOffset"":149},{""endOffset"":280,""label"":""outcome"",""startOffset"":270},{""endOffset"":545,""label"":""intervention"",""startOffset"":528}]}}]"
sod2gh,t5_2rtve,I had read that vaccines are highly unlikely to cause flares but not sure how true that is.,"[{""crowd-entity-annotation"":{""entities"":[{""endOffset"":77,""label"":""outcome"",""startOffset"":72},{""endOffset"":105,""label"":""intervention"",""startOffset"":98},{""endOffset"":213,""label"":""population"",""startOffset"":208},{""endOffset"":465,""label"":""outcome"",""startOffset"":456},{""endOffset"":478,""label"":""outcome"",""startOffset"":470},{""endOffset"":559,""label"":""outcome"",""startOffset"":546}]}}]"
q9vt22,t5_2syer,"In volunteers with elevated levels, one capsule of 500 mg of Terminalia bellerica extract, taken twice daily, decreased uric acid by a mean of 27.59%.","[{""crowd-entity-annotation"":{""entities"":[{""endOffset"":9,""label"":""intervention"",""startOffset"":0},{""endOffset"":188,""label"":""intervention"",""startOffset"":116},{""endOffset"":229,""label"":""outcome"",""startOffset"":190},{""endOffset"":371,""label"":""outcome"",""startOffset"":332},{""endOffset"":391,""label"":""outcome"",""startOffset"":376}]}}]"
rxzew6,t5_2s23e," I couldn't resist a Google search on the relationship between these marks and MS. What I am finding is that loads of people with multiple sclerosis have them, but no explanation as to why","[{""crowd-entity-annotation"":{""entities"":[{""endOffset"":198,""label"":""outcome"",""startOffset"":167},{""endOffset"":459,""label"":""population"",""startOffset"":457}]}}]"
sieihf,t5_2tyg2,Im working night shift all I can think of is how lucid and alive these people look and im over here dead n shit.,"[{""crowd-entity-annotation"":{""entities"":[]}}]"
pvp29c,t5_2r876,I also read what those consequences are with the very small group of patients (20!) that were currently in the database.,"[{""crowd-entity-annotation"":{""entities"":[{""endOffset"":128,""label"":""population"",""startOffset"":126}]}}]"
q4473a,t5_2r876," From everything I have researched, this is a rare mutation and specific to a region that I am from (could be wrong, but there is just not a lot of info I found on this mutation). 
","[{""crowd-entity-annotation"":{""entities"":[]}}]"
quqexb,t5_2rtve,I know prednisone slows healing,"[{""crowd-entity-annotation"":{""entities"":[{""endOffset"":78,""label"":""intervention"",""startOffset"":68},{""endOffset"":129,""label"":""outcome"",""startOffset"":120},{""endOffset"":139,""label"":""outcome"",""startOffset"":131},{""endOffset"":150,""label"":""outcome"",""startOffset"":144},{""endOffset"":681,""label"":""population"",""startOffset"":673}]}}]"
sn4d39,t5_2s3g1,"In more detail, there were clinical improvements in abdominal symptoms in 5.5%, 35.2% and 47.3% of the patients in the placebo, 30g FMT and 60g FMT groups, respectively, in fatigue in 21.8%, 53.7% and 52.7% of them, and in the quality of life in 7.3%, 61.1% and 58.2% of them (online supplementary table 5).","[{""crowd-entity-annotation"":{""entities"":[{""endOffset"":24,""label"":""intervention"",""startOffset"":21}]}}]"
r63x6o,t5_2syer,I would assume when you have covid your immune system is not attacking the joint crystals but rather focused on the virus,"[{""crowd-entity-annotation"":{""entities"":[{""endOffset"":63,""label"":""outcome"",""startOffset"":55},{""endOffset"":139,""label"":""population"",""startOffset"":133}]}}]"
s3d99l,t5_2s23e,"In their [*study*](https://www.science.org/doi/10.1126/science.abj8222), published Thursday in Science, the group examined data from 10 million people on active duty in the United States Armed Forces over two decades. The strength of their study, said its principal investigator, Dr. Alberto Ascherio, an epidemiologist at the Harvard T.H. Chan School of Public Health, is that they were able to follow people for years and ask whether infections with Epstein-Barr preceded multiple sclerosis.
","[{""crowd-entity-annotation"":{""entities"":[{""endOffset"":223,""label"":""population"",""startOffset"":205}]}}]"
ssxpq9,t5_2tyg2,My  new psychiatrist also came to the conclusion as well that the depression came from the psychosis not the other way around,"[{""crowd-entity-annotation"":{""entities"":[{""endOffset"":756,""label"":""outcome"",""startOffset"":745}]}}]"
rcpf0m,t5_2rtve,Ive heard it takes longer than that.,"[{""crowd-entity-annotation"":{""entities"":[{""endOffset"":18,""label"":""intervention"",""startOffset"":0},{""endOffset"":110,""label"":""outcome"",""startOffset"":83}]}}]"
s0dhpa,t5_2rtve,Many people I know have gotten omicron over the holidays and they had a really hard time recovering even though they were fully vaccinated.,"[{""crowd-entity-annotation"":{""entities"":[{""endOffset"":167,""label"":""outcome"",""startOffset"":159},{""endOffset"":266,""label"":""intervention"",""startOffset"":250}]}}]"
sg1edo,t5_2syer,The flare seems to have been caused by a new ARB and FloMax prescription for some blood pressure and prostate concerns,"[{""crowd-entity-annotation"":{""entities"":[{""endOffset"":374,""label"":""outcome"",""startOffset"":368},{""endOffset"":413,""label"":""intervention"",""startOffset"":409},{""endOffset"":424,""label"":""intervention"",""startOffset"":417}]}}]"
soieny,t5_2saq9,I talked to one other person with POTS who had this too . She thought maybe they were little lipomas .,"[{""crowd-entity-annotation"":{""entities"":[{""endOffset"":36,""label"":""population"",""startOffset"":31},{""endOffset"":133,""label"":""intervention"",""startOffset"":122},{""endOffset"":144,""label"":""intervention"",""startOffset"":134},{""endOffset"":173,""label"":""intervention"",""startOffset"":149},{""endOffset"":226,""label"":""outcome"",""startOffset"":186}]}}]"
sd7oxe,t5_2s23e,The worst side effect she mentioned was like a battery acid taste in your mouth for the entire 5-day regimen,"[{""crowd-entity-annotation"":{""entities"":[{""endOffset"":245,""label"":""intervention"",""startOffset"":236},{""endOffset"":568,""label"":""outcome"",""startOffset"":536}]}}]"
p8seho,t5_2r876,We found out that it isn't that normal just a couple of weeks ago.,"[{""crowd-entity-annotation"":{""entities"":[{""endOffset"":249,""label"":""population"",""startOffset"":244}]}}]"
rydoe9,t5_2s23e,"when anti-parasite medication is widely distributed to those areas, all sorts of benefits are seen from the reduction in worms and such, but also rates of asthma, allergies and other autoimmune diseases suddenly skyrocke","[{""crowd-entity-annotation"":{""entities"":[{""endOffset"":98,""label"":""population"",""startOffset"":87},{""endOffset"":299,""label"":""intervention"",""startOffset"":275},{""endOffset"":396,""label"":""outcome"",""startOffset"":378},{""endOffset"":431,""label"":""outcome"",""startOffset"":425},{""endOffset"":443,""label"":""outcome"",""startOffset"":433},{""endOffset"":472,""label"":""outcome"",""startOffset"":453}]}}]"
swfhbm,t5_2r876,Her issues are more related to her digestive system than her lungs,"[{""crowd-entity-annotation"":{""entities"":[]}}]"
swywgy,t5_2saq9,I know beta blockers can be very tough to withdraw,"[{""crowd-entity-annotation"":{""entities"":[{""endOffset"":11,""label"":""intervention"",""startOffset"":0},{""endOffset"":161,""label"":""outcome"",""startOffset"":156},{""endOffset"":202,""label"":""intervention"",""startOffset"":167},{""endOffset"":251,""label"":""intervention"",""startOffset"":237},{""endOffset"":309,""label"":""outcome"",""startOffset"":280},{""endOffset"":383,""label"":""intervention"",""startOffset"":368}]}}]"
s74iag,t5_2saq9,"So I researched it online and apparently the only treatment is either nifedepine, which lowers your blood pressure and therefore us POTS people can't take, or corticosteroid cream.","[{""crowd-entity-annotation"":{""entities"":[{""endOffset"":118,""label"":""intervention"",""startOffset"":108},{""endOffset"":152,""label"":""outcome"",""startOffset"":138},{""endOffset"":175,""label"":""population"",""startOffset"":170},{""endOffset"":217,""label"":""intervention"",""startOffset"":197}]}}]"
rg91hh,t5_2qlaa,I now believe this long-term use of PPIs has caused this,"[{""crowd-entity-annotation"":{""entities"":[{""endOffset"":2172,""label"":""outcome"",""startOffset"":2154},{""endOffset"":2298,""label"":""intervention"",""startOffset"":2293}]}}]"
sqb9re,t5_2tyg2,So I was reading an article that said learning something new improves neuron connections  and makes existing neural pathways stronger,"[{""crowd-entity-annotation"":{""entities"":[{""endOffset"":221,""label"":""population"",""startOffset"":212},{""endOffset"":237,""label"":""intervention"",""startOffset"":233},{""endOffset"":272,""label"":""outcome"",""startOffset"":264},{""endOffset"":283,""label"":""outcome"",""startOffset"":276}]}}]"
sbuvgh,t5_2tyg2,"From what I've read in this subreddit, it seems that almost no one shared a successful recovery story.","[{""crowd-entity-annotation"":{""entities"":[]}}]"
otpexb,t5_2syer,I swear it feels like drinking a bunch of water during a flareup eases the pain and immobility almost immediately after urinating.,"[{""crowd-entity-annotation"":{""entities"":[{""endOffset"":83,""label"":""intervention"",""startOffset"":58},{""endOffset"":101,""label"":""outcome"",""startOffset"":93},{""endOffset"":116,""label"":""outcome"",""startOffset"":111},{""endOffset"":131,""label"":""outcome"",""startOffset"":120}]}}]"
stvz18,t5_2syer,"200B;

[Nonpharmacological Management of Gout and Hyperuricemia: Hints for Better Lifestyle](https://www.ncbi.nlm.nih.gov/pmc/articles/PMC6125106/)

Folks it's articles like this that I think cause a lot of confusion ","[{""crowd-entity-annotation"":{""entities"":[{""endOffset"":296,""label"":""population"",""startOffset"":292}]}}]"
qq948x,t5_2rtve,I know it could also be the HCQ Im on,"[{""crowd-entity-annotation"":{""entities"":[{""endOffset"":304,""label"":""intervention"",""startOffset"":280},{""endOffset"":332,""label"":""population"",""startOffset"":323},{""endOffset"":403,""label"":""intervention"",""startOffset"":400},{""endOffset"":485,""label"":""population"",""startOffset"":478}]}}]"
rinmxs,t5_2qlaa,"The PH level of ACT is around 6, and Listerine is about 3-4.","[{""crowd-entity-annotation"":{""entities"":[{""endOffset"":25,""label"":""intervention"",""startOffset"":14},{""endOffset"":36,""label"":""outcome"",""startOffset"":30},{""endOffset"":75,""label"":""population"",""startOffset"":67}]}}]"
sfjyo9,t5_2r876,"I know the effects on us of kaftrio,","[{""crowd-entity-annotation"":{""entities"":[{""endOffset"":109,""label"":""intervention"",""startOffset"":101},{""endOffset"":185,""label"":""outcome"",""startOffset"":171}]}}]"
sgizzr,t5_2syer,I've learned a lot about my triggers,"[{""crowd-entity-annotation"":{""entities"":[{""endOffset"":30,""label"":""population"",""startOffset"":25},{""endOffset"":39,""label"":""outcome"",""startOffset"":30},{""endOffset"":549,""label"":""intervention"",""startOffset"":544}]}}]"
spd72r,t5_2s3g1,Vitamin D trial fails to improve QOL Among IBS patients,"[{""crowd-entity-annotation"":{""entities"":[{""endOffset"":9,""label"":""intervention"",""startOffset"":0},{""endOffset"":46,""label"":""population"",""startOffset"":43}]}}]"
rdnrpf,t5_2r876,Also most poops even with Creon would finish off with mucus coming out visibly at the end.,"[{""crowd-entity-annotation"":{""entities"":[{""endOffset"":316,""label"":""intervention"",""startOffset"":310},{""endOffset"":344,""label"":""outcome"",""startOffset"":338}]}}]"
s6aw61,t5_2rtve,As I know flares can cause anxiety too.,"[{""crowd-entity-annotation"":{""entities"":[{""endOffset"":528,""label"":""outcome"",""startOffset"":520}]}}]"
swfghc,t5_2saq9," I did the at home POTS test, when I lay down my resting heart rate is approx. 77, when I stand it goes up to 115 and after 10 minutes its still 115","[{""crowd-entity-annotation"":{""entities"":[{""endOffset"":460,""label"":""population"",""startOffset"":455}]}}]"
sbbvfx,t5_2r876,I've heard people say that there might be some side effects like stomach pain or,"[{""crowd-entity-annotation"":{""entities"":[{""endOffset"":67,""label"":""intervention"",""startOffset"":59},{""endOffset"":105,""label"":""outcome"",""startOffset"":98}]}}]"
sx760c,t5_2s3g1,It doesn't seem to be recommended to keep the low FODMAP diet during pregnancy and it seems to be worse for IBS-C sufferers from what I've read,"[{""crowd-entity-annotation"":{""entities"":[{""endOffset"":5,""label"":""population"",""startOffset"":0},{""endOffset"":76,""label"":""intervention"",""startOffset"":70},{""endOffset"":213,""label"":""outcome"",""startOffset"":205}]}}]"
rvfx6t,t5_2qlaa,since my doctor said i cant take it forever,"[{""crowd-entity-annotation"":{""entities"":[{""endOffset"":242,""label"":""intervention"",""startOffset"":210}]}}]"
